,Unnamed: 0.1,original_index,sentence,Unnamed: 0,date,year,month,day,author,title,url,section,publication,objectivity_classification,Emotional_appeal_classification,classification_raw,WordCount
0,0,0,next image 1 of 2 prev image 2 of 2 hiroshima japan  rescuers combed through mudcovered hillsides and near riverbanks tuesday to look for dozens of people still missing after days of heavy rains caused flooding and mudslides in southwestern japan where the death toll has risen to 122,0,7/9/2018 0:00,2018,7,9,Associated Press,Rescuers look through mud for Japan flood victims; 122 dead,https://www.foxnews.com/world/rescuers-look-through-mud-for-japan-flood-victims-122-dead,World,Fox News,True,True,Objective Emotional Appeal,50
1,1,0,officials and reports say more than 80 people are still unaccounted for many of them in the hardesthit hiroshima area,0,7/9/2018 0:00,2018,7,9,Associated Press,Rescuers look through mud for Japan flood victims; 122 dead,https://www.foxnews.com/world/rescuers-look-through-mud-for-japan-flood-victims-122-dead,World,Fox News,True,True,Objective Emotional Appeal,20
2,2,0,the fire and disaster management agency said 122 people have been confirmed dead as of early tuesday,0,7/9/2018 0:00,2018,7,9,Associated Press,Rescuers look through mud for Japan flood victims; 122 dead,https://www.foxnews.com/world/rescuers-look-through-mud-for-japan-flood-victims-122-dead,World,Fox News,True,False,Objective,17
3,3,0,several days of heavy rainfall that weather officials have called historic set off flooding and landslides in widespread areas of western japan including hiroshima okayama and ehime prefectures,0,7/9/2018 0:00,2018,7,9,Associated Press,Rescuers look through mud for Japan flood victims; 122 dead,https://www.foxnews.com/world/rescuers-look-through-mud-for-japan-flood-victims-122-dead,World,Fox News,True,False,Objective,28
4,4,0,many people started to return and check on their homes and begin cleanup after the rain stopped monday,0,7/9/2018 0:00,2018,7,9,Associated Press,Rescuers look through mud for Japan flood victims; 122 dead,https://www.foxnews.com/world/rescuers-look-through-mud-for-japan-flood-victims-122-dead,World,Fox News,True,False,Objective,18
5,5,0,the government has set up a taskforce to speed up deliveries of supplies and other support for evacuation centers and residents in the region but disrupted roads and other ground transportation have delayed shipment raising concerns of shortages,0,7/9/2018 0:00,2018,7,9,Associated Press,Rescuers look through mud for Japan flood victims; 122 dead,https://www.foxnews.com/world/rescuers-look-through-mud-for-japan-flood-victims-122-dead,World,Fox News,True,False,Objective,38
6,6,0,minoru katayama 86 rushed back to his home in mabi city in okayama prefecture on monday and found his 88yearold wife chiyoko dead on the first floor,0,7/9/2018 0:00,2018,7,9,Associated Press,Rescuers look through mud for Japan flood victims; 122 dead,https://www.foxnews.com/world/rescuers-look-through-mud-for-japan-flood-victims-122-dead,World,Fox News,True,True,Objective Emotional Appeal,27
7,7,0,floodwaters rose so fast they caught the couple by surprise,0,7/9/2018 0:00,2018,7,9,Associated Press,Rescuers look through mud for Japan flood victims; 122 dead,https://www.foxnews.com/world/rescuers-look-through-mud-for-japan-flood-victims-122-dead,World,Fox News,False,True,Subjective Emotional Appeal,10
8,8,0,my wife could not climb up the stairs and nobody else was around to help us out katayama told national broadcaster nhk,0,7/9/2018 0:00,2018,7,9,Associated Press,Rescuers look through mud for Japan flood victims; 122 dead,https://www.foxnews.com/world/rescuers-look-through-mud-for-japan-flood-victims-122-dead,World,Fox News,False,True,Subjective Emotional Appeal,22
9,9,0,his wife was among more than 20 people who were found dead in the city where a river dike collapsed,0,7/9/2018 0:00,2018,7,9,Associated Press,Rescuers look through mud for Japan flood victims; 122 dead,https://www.foxnews.com/world/rescuers-look-through-mud-for-japan-flood-victims-122-dead,World,Fox News,True,True,Objective Emotional Appeal,20
10,10,0,the assessment of casualties has been difficult because of the widespread area affected,0,7/9/2018 0:00,2018,7,9,Associated Press,Rescuers look through mud for Japan flood victims; 122 dead,https://www.foxnews.com/world/rescuers-look-through-mud-for-japan-flood-victims-122-dead,World,Fox News,True,False,Objective,13
11,11,0,officials in ehime prefecture asked the central government to review a weather warning system noting that rain warnings were issued after damage and casualties were occurring,0,7/9/2018 0:00,2018,7,9,Associated Press,Rescuers look through mud for Japan flood victims; 122 dead,https://www.foxnews.com/world/rescuers-look-through-mud-for-japan-flood-victims-122-dead,World,Fox News,True,False,Objective,26
12,12,0,the japan meteorological agency said as much as 10 centimeters 3 inches of rain per hour fell on large parts of southwestern japan,0,7/9/2018 0:00,2018,7,9,Associated Press,Rescuers look through mud for Japan flood victims; 122 dead,https://www.foxnews.com/world/rescuers-look-through-mud-for-japan-flood-victims-122-dead,World,Fox News,True,False,Objective,23
13,13,0,some homes were smashed while others were tilting precariously,0,7/9/2018 0:00,2018,7,9,Associated Press,Rescuers look through mud for Japan flood victims; 122 dead,https://www.foxnews.com/world/rescuers-look-through-mud-for-japan-flood-victims-122-dead,World,Fox News,True,True,Objective Emotional Appeal,9
14,14,0,rivers overflowed turning towns into lakes and leaving dozens of people stranded on rooftops,0,7/9/2018 0:00,2018,7,9,Associated Press,Rescuers look through mud for Japan flood victims; 122 dead,https://www.foxnews.com/world/rescuers-look-through-mud-for-japan-flood-victims-122-dead,World,Fox News,True,True,Objective Emotional Appeal,14
15,15,0,military paddle boats and helicopters brought people to the ground,0,7/9/2018 0:00,2018,7,9,Associated Press,Rescuers look through mud for Japan flood victims; 122 dead,https://www.foxnews.com/world/rescuers-look-through-mud-for-japan-flood-victims-122-dead,World,Fox News,True,False,Objective,10
16,16,0,thousands of homes were without clean water and electricity in hiroshima and other hardhit areas where many people lined up for water tanks under the scorching sun with temperature rising as high as 34 celsius 93 fahrenheit which prompted concerns about peopleaposs health,0,7/9/2018 0:00,2018,7,9,Associated Press,Rescuers look through mud for Japan flood victims; 122 dead,https://www.foxnews.com/world/rescuers-look-through-mud-for-japan-flood-victims-122-dead,World,Fox News,True,True,Objective Emotional Appeal,43
17,17,0,thousands have evacuated their homes,0,7/9/2018 0:00,2018,7,9,Associated Press,Rescuers look through mud for Japan flood victims; 122 dead,https://www.foxnews.com/world/rescuers-look-through-mud-for-japan-flood-victims-122-dead,World,Fox News,True,True,Objective Emotional Appeal,5
18,18,0,at a local elementary school in hiroshimaaposs yano district dozens of residents took shelter and some shared their stories of narrow escape from the landslides and floods,0,7/9/2018 0:00,2018,7,9,Associated Press,Rescuers look through mud for Japan flood victims; 122 dead,https://www.foxnews.com/world/rescuers-look-through-mud-for-japan-flood-victims-122-dead,World,Fox News,True,True,Objective Emotional Appeal,27
19,19,0,supplies such as water blankets and cellphone chargers were provided,0,7/9/2018 0:00,2018,7,9,Associated Press,Rescuers look through mud for Japan flood victims; 122 dead,https://www.foxnews.com/world/rescuers-look-through-mud-for-japan-flood-victims-122-dead,World,Fox News,True,False,Objective,10
20,20,0,ryutaro hirakawa 18 said he fled his house after smelling a strange odor coming from the ground a sign of a landslide,0,7/9/2018 0:00,2018,7,9,Associated Press,Rescuers look through mud for Japan flood victims; 122 dead,https://www.foxnews.com/world/rescuers-look-through-mud-for-japan-flood-victims-122-dead,World,Fox News,True,True,Objective Emotional Appeal,22
21,21,0,the smell of soil and grass was so strong when i opened the window he said,0,7/9/2018 0:00,2018,7,9,Associated Press,Rescuers look through mud for Japan flood victims; 122 dead,https://www.foxnews.com/world/rescuers-look-through-mud-for-japan-flood-victims-122-dead,World,Fox News,False,False,Subjective,16
22,22,0,there were landslides,0,7/9/2018 0:00,2018,7,9,Associated Press,Rescuers look through mud for Japan flood victims; 122 dead,https://www.foxnews.com/world/rescuers-look-through-mud-for-japan-flood-victims-122-dead,World,Fox News,False,False,Unclassifiable,3
23,23,0,another resident 82yearold saburo yokoyama said he was horrified when he saw floodwater flowing just outside his house,0,7/9/2018 0:00,2018,7,9,Associated Press,Rescuers look through mud for Japan flood victims; 122 dead,https://www.foxnews.com/world/rescuers-look-through-mud-for-japan-flood-victims-122-dead,World,Fox News,True,True,Objective Emotional Appeal,18
24,24,0,it was scary just scary,0,7/9/2018 0:00,2018,7,9,Associated Press,Rescuers look through mud for Japan flood victims; 122 dead,https://www.foxnews.com/world/rescuers-look-through-mud-for-japan-flood-victims-122-dead,World,Fox News,False,True,Subjective Emotional Appeal,5
25,25,0,in front of our house had become a river and was making a huge noise he said,0,7/9/2018 0:00,2018,7,9,Associated Press,Rescuers look through mud for Japan flood victims; 122 dead,https://www.foxnews.com/world/rescuers-look-through-mud-for-japan-flood-victims-122-dead,World,Fox News,False,False,Unclassifiable,17
26,26,0,prime minister shinzo abe canceled his planned july 1118 trip to europe and the middle east to oversee the emergency response,0,7/9/2018 0:00,2018,7,9,Associated Press,Rescuers look through mud for Japan flood victims; 122 dead,https://www.foxnews.com/world/rescuers-look-through-mud-for-japan-flood-victims-122-dead,World,Fox News,True,False,Objective,21
27,27,0,abe said earlier monday that the government had dispatched 73000 troops and emergency workers for the search and rescue effort,0,7/9/2018 0:00,2018,7,9,Associated Press,Rescuers look through mud for Japan flood victims; 122 dead,https://www.foxnews.com/world/rescuers-look-through-mud-for-japan-flood-victims-122-dead,World,Fox News,True,False,Objective,20
28,28,0, yamaguchi reported from tokyo,0,7/9/2018 0:00,2018,7,9,Associated Press,Rescuers look through mud for Japan flood victims; 122 dead,https://www.foxnews.com/world/rescuers-look-through-mud-for-japan-flood-victims-122-dead,World,Fox News,True,False,Objective,5
29,29,0, follow haruka nuga on twitter at httpstwittercomharukanuga her work can be found at httpswwwapnewscomsearchharuka20nuga,0,7/9/2018 0:00,2018,7,9,Associated Press,Rescuers look through mud for Japan flood victims; 122 dead,https://www.foxnews.com/world/rescuers-look-through-mud-for-japan-flood-victims-122-dead,World,Fox News,True,False,Objective,15
30,30,1,a 15foot 1300pound saltwater croc was captured in australia,1,7/10/2018 0:00,2018,7,10,Ryan Gaydos,"Australian rangers trap gigantic saltwater crocodile after decade-long hunt, officials say",https://www.foxnews.com/world/australian-rangers-trap-gigantic-saltwater-crocodile-after-decade-long-hunt-officials-say,Reptiles,Fox News,True,False,Objective,9
31,31,1,nt department of tourism and culture via ap a 15foot saltwater crocodile was captured monday in a region of australia popular with tourists because it is thought to be safe from the reptiles wildlife rangers said,1,7/10/2018 0:00,2018,7,10,Ryan Gaydos,"Australian rangers trap gigantic saltwater crocodile after decade-long hunt, officials say",https://www.foxnews.com/world/australian-rangers-trap-gigantic-saltwater-crocodile-after-decade-long-hunt-officials-say,Reptiles,Fox News,True,False,Objective,36
32,32,1,the 1300pound predator was caught about 185 miles from the ocean and about 19 miles downstream from katherine gorge a major tourist attraction outside the town of katherine the northern territory parks and wildlife officials said,1,7/10/2018 0:00,2018,7,10,Ryan Gaydos,"Australian rangers trap gigantic saltwater crocodile after decade-long hunt, officials say",https://www.foxnews.com/world/australian-rangers-trap-gigantic-saltwater-crocodile-after-decade-long-hunt-officials-say,Reptiles,Fox News,True,False,Objective,36
33,33,1,authorities had been hunting the giant crocodile for a decade ranger john burke said,1,7/10/2018 0:00,2018,7,10,Ryan Gaydos,"Australian rangers trap gigantic saltwater crocodile after decade-long hunt, officials say",https://www.foxnews.com/world/australian-rangers-trap-gigantic-saltwater-crocodile-after-decade-long-hunt-officials-say,Reptiles,Fox News,True,False,Objective,14
34,34,1,weaposve called it a lot of things over the years because itaposs been so hard to catch burke said,1,7/10/2018 0:00,2018,7,10,Ryan Gaydos,"Australian rangers trap gigantic saltwater crocodile after decade-long hunt, officials say",https://www.foxnews.com/world/australian-rangers-trap-gigantic-saltwater-crocodile-after-decade-long-hunt-officials-say,Reptiles,Fox News,False,False,Unclassifiable,19
35,35,1,rangers had been hunting the croc for a decade,1,7/10/2018 0:00,2018,7,10,Ryan Gaydos,"Australian rangers trap gigantic saltwater crocodile after decade-long hunt, officials say",https://www.foxnews.com/world/australian-rangers-trap-gigantic-saltwater-crocodile-after-decade-long-hunt-officials-say,Reptiles,Fox News,True,False,Objective,9
36,36,1,nt department of tourism and culture via ap on record this is the biggest saltwater crocodile removed from the katherine management zone he said referring to the part of the river where saltwater crocs are captured because they get too close to the tourist areas,1,7/10/2018 0:00,2018,7,10,Ryan Gaydos,"Australian rangers trap gigantic saltwater crocodile after decade-long hunt, officials say",https://www.foxnews.com/world/australian-rangers-trap-gigantic-saltwater-crocodile-after-decade-long-hunt-officials-say,Reptiles,Fox News,True,False,Objective,45
37,37,1,saltwater crocodiles are protected in australia,1,7/10/2018 0:00,2018,7,10,Ryan Gaydos,"Australian rangers trap gigantic saltwater crocodile after decade-long hunt, officials say",https://www.foxnews.com/world/australian-rangers-trap-gigantic-saltwater-crocodile-after-decade-long-hunt-officials-say,Reptiles,Fox News,True,False,Objective,6
38,38,1,webb said the capture proved that the government protection program worked,1,7/10/2018 0:00,2018,7,10,Ryan Gaydos,"Australian rangers trap gigantic saltwater crocodile after decade-long hunt, officials say",https://www.foxnews.com/world/australian-rangers-trap-gigantic-saltwater-crocodile-after-decade-long-hunt-officials-say,Reptiles,Fox News,False,False,Unclassifiable,11
39,39,1,itaposs worrying but itaposs good that theyaposve got an active program and theyaposve got active traps he said,1,7/10/2018 0:00,2018,7,10,Ryan Gaydos,"Australian rangers trap gigantic saltwater crocodile after decade-long hunt, officials say",https://www.foxnews.com/world/australian-rangers-trap-gigantic-saltwater-crocodile-after-decade-long-hunt-officials-say,Reptiles,Fox News,False,True,Subjective Emotional Appeal,18
40,40,1,the crocodile was taken to a farm outside katherine where its likely to become the newest tourist attraction,1,7/10/2018 0:00,2018,7,10,Ryan Gaydos,"Australian rangers trap gigantic saltwater crocodile after decade-long hunt, officials say",https://www.foxnews.com/world/australian-rangers-trap-gigantic-saltwater-crocodile-after-decade-long-hunt-officials-say,Reptiles,Fox News,True,False,Objective,18
41,41,1,the associated press contributed to this report,1,7/10/2018 0:00,2018,7,10,Ryan Gaydos,"Australian rangers trap gigantic saltwater crocodile after decade-long hunt, officials say",https://www.foxnews.com/world/australian-rangers-trap-gigantic-saltwater-crocodile-after-decade-long-hunt-officials-say,Reptiles,Fox News,True,False,Objective,7
42,42,2,while restaurant leaders reportedly agree that rey was a good worker they maintain that he was fired for an aggressive tone and nature istock union protestors and celebrity advocates have decided that waiters tips arent big enough,2,8/1/2018 0:00,2018,8,1,John Stossel,John Stossel: Are looney liberals and smug celebrities about to put an end to tipping?,https://www.foxnews.com/opinion/john-stossel-are-looney-liberals-and-smug-celebrities-about-to-put-an-end-to-tipping,OPINION,Fox News,True,True,Objective Emotional Appeal,37
43,43,2,they are upset that in 43 states  tipped workers can be paid a lower minimum wage as low as 213 an hour,2,8/1/2018 0:00,2018,8,1,John Stossel,John Stossel: Are looney liberals and smug celebrities about to put an end to tipping?,https://www.foxnews.com/opinion/john-stossel-are-looney-liberals-and-smug-celebrities-about-to-put-an-end-to-tipping,OPINION,Fox News,False,True,Subjective Emotional Appeal,23
44,44,2,not fair,2,8/1/2018 0:00,2018,8,1,John Stossel,John Stossel: Are looney liberals and smug celebrities about to put an end to tipping?,https://www.foxnews.com/opinion/john-stossel-are-looney-liberals-and-smug-celebrities-about-to-put-an-end-to-tipping,OPINION,Fox News,False,False,Unclassifiable,2
45,45,2,shout celebrities like jane fonda who recorded commercials saying thats barely enough to buy a large cup of coffee as usual those who want the government to decide that workers must be paid more insist that women and minorities are hurt by the market,2,8/1/2018 0:00,2018,8,1,John Stossel,John Stossel: Are looney liberals and smug celebrities about to put an end to tipping?,https://www.foxnews.com/opinion/john-stossel-are-looney-liberals-and-smug-celebrities-about-to-put-an-end-to-tipping,OPINION,Fox News,False,True,Subjective Emotional Appeal,44
46,46,2,but waitress alcieli felipe is a minority and a woman,2,8/1/2018 0:00,2018,8,1,John Stossel,John Stossel: Are looney liberals and smug celebrities about to put an end to tipping?,https://www.foxnews.com/opinion/john-stossel-are-looney-liberals-and-smug-celebrities-about-to-put-an-end-to-tipping,OPINION,Fox News,False,True,Subjective Emotional Appeal,10
47,47,2,she says the celebrities and politicians should butt out,2,8/1/2018 0:00,2018,8,1,John Stossel,John Stossel: Are looney liberals and smug celebrities about to put an end to tipping?,https://www.foxnews.com/opinion/john-stossel-are-looney-liberals-and-smug-celebrities-about-to-put-an-end-to-tipping,OPINION,Fox News,False,False,Subjective,9
48,48,2,thanks to tips felipe says in my new internet video  she makes 25 an hour,2,8/1/2018 0:00,2018,8,1,John Stossel,John Stossel: Are looney liberals and smug celebrities about to put an end to tipping?,https://www.foxnews.com/opinion/john-stossel-are-looney-liberals-and-smug-celebrities-about-to-put-an-end-to-tipping,OPINION,Fox News,False,False,Subjective,16
49,49,2,by the end of the year 48000 to 50000 she understands that if government raises the minimum itll be harder for restaurants to keep the same amount of employees  the busboy will be cut shes right,2,8/1/2018 0:00,2018,8,1,John Stossel,John Stossel: Are looney liberals and smug celebrities about to put an end to tipping?,https://www.foxnews.com/opinion/john-stossel-are-looney-liberals-and-smug-celebrities-about-to-put-an-end-to-tipping,OPINION,Fox News,False,False,Subjective,37
50,50,2,minimum wage laws dont just raise salaries without cost,2,8/1/2018 0:00,2018,8,1,John Stossel,John Stossel: Are looney liberals and smug celebrities about to put an end to tipping?,https://www.foxnews.com/opinion/john-stossel-are-looney-liberals-and-smug-celebrities-about-to-put-an-end-to-tipping,OPINION,Fox News,False,False,Subjective,9
51,51,2,if they did why not set the minimum at 100 an hour,2,8/1/2018 0:00,2018,8,1,John Stossel,John Stossel: Are looney liberals and smug celebrities about to put an end to tipping?,https://www.foxnews.com/opinion/john-stossel-are-looney-liberals-and-smug-celebrities-about-to-put-an-end-to-tipping,OPINION,Fox News,False,False,Subjective,12
52,52,2,every time a minimum is raised somebody loses something,2,8/1/2018 0:00,2018,8,1,John Stossel,John Stossel: Are looney liberals and smug celebrities about to put an end to tipping?,https://www.foxnews.com/opinion/john-stossel-are-looney-liberals-and-smug-celebrities-about-to-put-an-end-to-tipping,OPINION,Fox News,False,True,Subjective Emotional Appeal,9
53,53,2,in the san francisco bay area youve got a 14 percent increase in restaurant closures for each dollar increase in the minimum wage says michael saltsman of the employment policy institute,2,8/1/2018 0:00,2018,8,1,John Stossel,John Stossel: Are looney liberals and smug celebrities about to put an end to tipping?,https://www.foxnews.com/opinion/john-stossel-are-looney-liberals-and-smug-celebrities-about-to-put-an-end-to-tipping,OPINION,Fox News,True,False,Objective,31
54,54,2,activists are unmoved,2,8/1/2018 0:00,2018,8,1,John Stossel,John Stossel: Are looney liberals and smug celebrities about to put an end to tipping?,https://www.foxnews.com/opinion/john-stossel-are-looney-liberals-and-smug-celebrities-about-to-put-an-end-to-tipping,OPINION,Fox News,False,False,Unclassifiable,3
55,55,2,the problem with tips is that theyre very inconsistent university of buffalo law professor nicole hallett told me,2,8/1/2018 0:00,2018,8,1,John Stossel,John Stossel: Are looney liberals and smug celebrities about to put an end to tipping?,https://www.foxnews.com/opinion/john-stossel-are-looney-liberals-and-smug-celebrities-about-to-put-an-end-to-tipping,OPINION,Fox News,False,False,Subjective,18
56,56,2,hallett is one of those activist professors who gets students to join her in social justice protests,2,8/1/2018 0:00,2018,8,1,John Stossel,John Stossel: Are looney liberals and smug celebrities about to put an end to tipping?,https://www.foxnews.com/opinion/john-stossel-are-looney-liberals-and-smug-celebrities-about-to-put-an-end-to-tipping,OPINION,Fox News,False,True,Subjective Emotional Appeal,17
57,57,2,i simply dont believe that increasing the minimum wage for tipped workers will lead to a reduction in the restaurant workforce she said,2,8/1/2018 0:00,2018,8,1,John Stossel,John Stossel: Are looney liberals and smug celebrities about to put an end to tipping?,https://www.foxnews.com/opinion/john-stossel-are-looney-liberals-and-smug-celebrities-about-to-put-an-end-to-tipping,OPINION,Fox News,False,False,Subjective,23
58,58,2,studies have shown that restaurants have been able to bear those costs i pointed out that last time new york raised its minimum the city lost 270 restaurants ,2,8/1/2018 0:00,2018,8,1,John Stossel,John Stossel: Are looney liberals and smug celebrities about to put an end to tipping?,https://www.foxnews.com/opinion/john-stossel-are-looney-liberals-and-smug-celebrities-about-to-put-an-end-to-tipping,OPINION,Fox News,True,False,Objective,29
59,59,2,restaurants always close she replied,2,8/1/2018 0:00,2018,8,1,John Stossel,John Stossel: Are looney liberals and smug celebrities about to put an end to tipping?,https://www.foxnews.com/opinion/john-stossel-are-looney-liberals-and-smug-celebrities-about-to-put-an-end-to-tipping,OPINION,Fox News,False,False,Subjective,5
60,60,2,restaurants dont always close responds saltsman,2,8/1/2018 0:00,2018,8,1,John Stossel,John Stossel: Are looney liberals and smug celebrities about to put an end to tipping?,https://www.foxnews.com/opinion/john-stossel-are-looney-liberals-and-smug-celebrities-about-to-put-an-end-to-tipping,OPINION,Fox News,False,False,Unclassifiable,6
61,61,2,yeah theres turnover in the industry but what were doing now to an industry where theres low profit margins jacking up restaurant closures  somethings not right the media rarely focus on those closings,2,8/1/2018 0:00,2018,8,1,John Stossel,John Stossel: Are looney liberals and smug celebrities about to put an end to tipping?,https://www.foxnews.com/opinion/john-stossel-are-looney-liberals-and-smug-celebrities-about-to-put-an-end-to-tipping,OPINION,Fox News,False,True,Subjective Emotional Appeal,34
62,62,2,we cant interview people who are never hired we dont know who they are,2,8/1/2018 0:00,2018,8,1,John Stossel,John Stossel: Are looney liberals and smug celebrities about to put an end to tipping?,https://www.foxnews.com/opinion/john-stossel-are-looney-liberals-and-smug-celebrities-about-to-put-an-end-to-tipping,OPINION,Fox News,False,False,Subjective,14
63,63,2,instead activists lead reporters to workers who talk about struggling to pay rent,2,8/1/2018 0:00,2018,8,1,John Stossel,John Stossel: Are looney liberals and smug celebrities about to put an end to tipping?,https://www.foxnews.com/opinion/john-stossel-are-looney-liberals-and-smug-celebrities-about-to-put-an-end-to-tipping,OPINION,Fox News,True,True,Objective Emotional Appeal,13
64,64,2,fortysix percent of tipped workers nationwide rely on public benefits like food stamps hallett told me,2,8/1/2018 0:00,2018,8,1,John Stossel,John Stossel: Are looney liberals and smug celebrities about to put an end to tipping?,https://www.foxnews.com/opinion/john-stossel-are-looney-liberals-and-smug-celebrities-about-to-put-an-end-to-tipping,OPINION,Fox News,True,False,Objective,16
65,65,2,i pointed out that many tipped workers are eligible for benefits because they dont report tip income to the government,2,8/1/2018 0:00,2018,8,1,John Stossel,John Stossel: Are looney liberals and smug celebrities about to put an end to tipping?,https://www.foxnews.com/opinion/john-stossel-are-looney-liberals-and-smug-celebrities-about-to-put-an-end-to-tipping,OPINION,Fox News,True,False,Objective,20
66,66,2,she didnt dispute that,2,8/1/2018 0:00,2018,8,1,John Stossel,John Stossel: Are looney liberals and smug celebrities about to put an end to tipping?,https://www.foxnews.com/opinion/john-stossel-are-looney-liberals-and-smug-celebrities-about-to-put-an-end-to-tipping,OPINION,Fox News,False,False,Unclassifiable,4
67,67,2,many restaurants and restaurant workers donapost report 100 percent of their income she acknowledged,2,8/1/2018 0:00,2018,8,1,John Stossel,John Stossel: Are looney liberals and smug celebrities about to put an end to tipping?,https://www.foxnews.com/opinion/john-stossel-are-looney-liberals-and-smug-celebrities-about-to-put-an-end-to-tipping,OPINION,Fox News,True,False,Objective,14
68,68,2,hallett and other higherminimum activists also claim that tipping should be discouraged because it causes sexual harassment,2,8/1/2018 0:00,2018,8,1,John Stossel,John Stossel: Are looney liberals and smug celebrities about to put an end to tipping?,https://www.foxnews.com/opinion/john-stossel-are-looney-liberals-and-smug-celebrities-about-to-put-an-end-to-tipping,OPINION,Fox News,False,True,Subjective Emotional Appeal,17
69,69,2,sarah jessica parker reese witherspoon natalie portman jane fonda and 12 other actresses wrote a letter urging new yorks governor to increase the minimum wage claiming that relying on tips creates a more permissive work environment where customers feel entitled to abuse women in exchange for service tipping causes customers to abuse women,2,8/1/2018 0:00,2018,8,1,John Stossel,John Stossel: Are looney liberals and smug celebrities about to put an end to tipping?,https://www.foxnews.com/opinion/john-stossel-are-looney-liberals-and-smug-celebrities-about-to-put-an-end-to-tipping,OPINION,Fox News,True,True,Objective Emotional Appeal,53
70,70,2,saltsman says research using federal data doesnt support that ,2,8/1/2018 0:00,2018,8,1,John Stossel,John Stossel: Are looney liberals and smug celebrities about to put an end to tipping?,https://www.foxnews.com/opinion/john-stossel-are-looney-liberals-and-smug-celebrities-about-to-put-an-end-to-tipping,OPINION,Fox News,True,False,Objective,10
71,71,2, data shows some of the states that have gone down this path that the activists want changing their tipping system actually have a higher rate of sexual harassment when i pointed that out to hallett she replied sexual harassment is complicated no single policy is going to eliminate that problem so raising the minimum wont reduce sexual harassment but will raise prices will force some restaurants to either fire workers or close and will reduce tip income,2,8/1/2018 0:00,2018,8,1,John Stossel,John Stossel: Are looney liberals and smug celebrities about to put an end to tipping?,https://www.foxnews.com/opinion/john-stossel-are-looney-liberals-and-smug-celebrities-about-to-put-an-end-to-tipping,OPINION,Fox News,True,False,Objective,78
72,72,2,this is supposed to help restaurant workers,2,8/1/2018 0:00,2018,8,1,John Stossel,John Stossel: Are looney liberals and smug celebrities about to put an end to tipping?,https://www.foxnews.com/opinion/john-stossel-are-looney-liberals-and-smug-celebrities-about-to-put-an-end-to-tipping,OPINION,Fox News,False,False,Subjective,7
73,73,2,many object to being helped when maine voters increased the minimum so many restaurant workers protested that the politicians reversed the decision,2,8/1/2018 0:00,2018,8,1,John Stossel,John Stossel: Are looney liberals and smug celebrities about to put an end to tipping?,https://www.foxnews.com/opinion/john-stossel-are-looney-liberals-and-smug-celebrities-about-to-put-an-end-to-tipping,OPINION,Fox News,True,False,Objective,22
74,74,2,alcieli felipe doesnt want the government helping her either we are fine,2,8/1/2018 0:00,2018,8,1,John Stossel,John Stossel: Are looney liberals and smug celebrities about to put an end to tipping?,https://www.foxnews.com/opinion/john-stossel-are-looney-liberals-and-smug-celebrities-about-to-put-an-end-to-tipping,OPINION,Fox News,False,False,Unclassifiable,12
75,75,2,who are those people,2,8/1/2018 0:00,2018,8,1,John Stossel,John Stossel: Are looney liberals and smug celebrities about to put an end to tipping?,https://www.foxnews.com/opinion/john-stossel-are-looney-liberals-and-smug-celebrities-about-to-put-an-end-to-tipping,OPINION,Fox News,False,False,Unclassifiable,4
76,76,2,have they worked in the restaurant industry most havent,2,8/1/2018 0:00,2018,8,1,John Stossel,John Stossel: Are looney liberals and smug celebrities about to put an end to tipping?,https://www.foxnews.com/opinion/john-stossel-are-looney-liberals-and-smug-celebrities-about-to-put-an-end-to-tipping,OPINION,Fox News,False,False,Unclassifiable,9
77,77,2,im a free market guy,2,8/1/2018 0:00,2018,8,1,John Stossel,John Stossel: Are looney liberals and smug celebrities about to put an end to tipping?,https://www.foxnews.com/opinion/john-stossel-are-looney-liberals-and-smug-celebrities-about-to-put-an-end-to-tipping,OPINION,Fox News,False,False,Subjective,5
78,78,2,i wonder why should there be any minimum,2,8/1/2018 0:00,2018,8,1,John Stossel,John Stossel: Are looney liberals and smug celebrities about to put an end to tipping?,https://www.foxnews.com/opinion/john-stossel-are-looney-liberals-and-smug-celebrities-about-to-put-an-end-to-tipping,OPINION,Fox News,False,False,Subjective,8
79,79,2,why cant the employer and employee make whatever deal they want that policy has been rejected hallett told me rejected for the last hundred years,2,8/1/2018 0:00,2018,8,1,John Stossel,John Stossel: Are looney liberals and smug celebrities about to put an end to tipping?,https://www.foxnews.com/opinion/john-stossel-are-looney-liberals-and-smug-celebrities-about-to-put-an-end-to-tipping,OPINION,Fox News,False,False,Subjective,25
80,80,2,were not in that world unfortunately we arent,2,8/1/2018 0:00,2018,8,1,John Stossel,John Stossel: Are looney liberals and smug celebrities about to put an end to tipping?,https://www.foxnews.com/opinion/john-stossel-are-looney-liberals-and-smug-celebrities-about-to-put-an-end-to-tipping,OPINION,Fox News,False,False,Subjective,8
81,81,2,we live in a world where activists and government protect workers right out of their jobs,2,8/1/2018 0:00,2018,8,1,John Stossel,John Stossel: Are looney liberals and smug celebrities about to put an end to tipping?,https://www.foxnews.com/opinion/john-stossel-are-looney-liberals-and-smug-celebrities-about-to-put-an-end-to-tipping,OPINION,Fox News,False,True,Subjective Emotional Appeal,16
82,82,3,united nations  un peacekeepers will remain in the disputed abyei region on the sudansouth sudan border for another six months but the security council is trimming the force while encouraging the two nations to resolve their stalemate over the oilrich area,3,5/15/2018 0:00,2018,5,15,Associated Press,"UN peacekeeping force to stay, but shrink, in Abyei region",https://www.foxnews.com/world/un-peacekeeping-force-to-stay-but-shrink-in-abyei-region,World,Fox News,True,False,Objective,42
83,83,3,the council unanimously agreed tuesday to extend the peacekeeping mission until midnovember,3,5/15/2018 0:00,2018,5,15,Associated Press,"UN peacekeeping force to stay, but shrink, in Abyei region",https://www.foxnews.com/world/un-peacekeeping-force-to-stay-but-shrink-in-abyei-region,World,Fox News,True,False,Objective,12
84,84,3,but the renewal lowers the troop ceiling to 4500 from nearly 4800 and expresses disappointment at the pace of progress toward a political resolution,3,5/15/2018 0:00,2018,5,15,Associated Press,"UN peacekeeping force to stay, but shrink, in Abyei region",https://www.foxnews.com/world/un-peacekeeping-force-to-stay-but-shrink-in-abyei-region,World,Fox News,True,False,Objective,24
85,85,3,the mission is known as unisfa,3,5/15/2018 0:00,2018,5,15,Associated Press,"UN peacekeeping force to stay, but shrink, in Abyei region",https://www.foxnews.com/world/un-peacekeeping-force-to-stay-but-shrink-in-abyei-region,World,Fox News,True,False,Objective,6
86,86,3,it has been in abyei since 2011,3,5/15/2018 0:00,2018,5,15,Associated Press,"UN peacekeeping force to stay, but shrink, in Abyei region",https://www.foxnews.com/world/un-peacekeeping-force-to-stay-but-shrink-in-abyei-region,World,Fox News,True,False,Objective,7
87,87,3,a decadeslong civil war between sudanaposs north and south ended with a 2005 peace deal that allowed for south sudan to become independent,3,5/15/2018 0:00,2018,5,15,Associated Press,"UN peacekeeping force to stay, but shrink, in Abyei region",https://www.foxnews.com/world/un-peacekeeping-force-to-stay-but-shrink-in-abyei-region,World,Fox News,True,False,Objective,23
88,88,3,the pact also required both sides to work out the final status of abyei but itaposs still unresolved,3,5/15/2018 0:00,2018,5,15,Associated Press,"UN peacekeeping force to stay, but shrink, in Abyei region",https://www.foxnews.com/world/un-peacekeeping-force-to-stay-but-shrink-in-abyei-region,World,Fox News,True,False,Objective,18
89,89,4,close video trump contradicts john bolton on north korea policy president breaks with national security adviser john boltons comment that the us would use the libya model for denuclearizing north korea reaction and analysis from david lawler world editor for axios,4,5/17/2018 0:00,2018,5,17,Associated Press,Trump tells NK's Kim to denuclearize or risk overthrow,https://www.foxnews.com/us/trump-tells-nks-kim-to-denuclearize-or-risk-overthrow,MILITARY,Fox News,False,False,Unclassifiable,41
90,90,4,washington  president donald trump laid out a stark choice for north koreaaposs kim jong un ahead of their planned summit next month abandon nuclear weapons and be rewarded with protections or risk being overthrown and possible death if the arsenal remains,4,5/17/2018 0:00,2018,5,17,Associated Press,Trump tells NK's Kim to denuclearize or risk overthrow,https://www.foxnews.com/us/trump-tells-nks-kim-to-denuclearize-or-risk-overthrow,MILITARY,Fox News,True,True,Objective Emotional Appeal,42
91,91,4,trump maintained the scheduled june 12 meeting in singapore is on track despite the northaposs threat wednesday to cancel over concerns about the us push to see the complete denuclearization of the korean peninsula,4,5/17/2018 0:00,2018,5,17,Associated Press,Trump tells NK's Kim to denuclearize or risk overthrow,https://www.foxnews.com/us/trump-tells-nks-kim-to-denuclearize-or-risk-overthrow,MILITARY,Fox News,True,False,Objective,34
92,92,4,the north has argued it needs its nuclear weapons to preserve its security and has expressed concerns about giving up its nuclear program,4,5/17/2018 0:00,2018,5,17,Associated Press,Trump tells NK's Kim to denuclearize or risk overthrow,https://www.foxnews.com/us/trump-tells-nks-kim-to-denuclearize-or-risk-overthrow,MILITARY,Fox News,True,False,Objective,23
93,93,4,the north cites the example of former libyan leader moammar gadhafi who died at the hands of rebel forces amid a popular uprising in october 2011 he had given up his nuclear program in the 2000s,4,5/17/2018 0:00,2018,5,17,Associated Press,Trump tells NK's Kim to denuclearize or risk overthrow,https://www.foxnews.com/us/trump-tells-nks-kim-to-denuclearize-or-risk-overthrow,MILITARY,Fox News,True,False,Objective,36
94,94,4,national security adviser john bolton explicitly cited the libya model of 20032004 as a basis for the north korea talks last month which drew personal rebuke from the north korean government wednesday,4,5/17/2018 0:00,2018,5,17,Associated Press,Trump tells NK's Kim to denuclearize or risk overthrow,https://www.foxnews.com/us/trump-tells-nks-kim-to-denuclearize-or-risk-overthrow,MILITARY,Fox News,True,False,Objective,32
95,95,4,trying to address the north korean concerns the president said if kim were to agree to denuclearize heaposll get protections that would be very strong,4,5/17/2018 0:00,2018,5,17,Associated Press,Trump tells NK's Kim to denuclearize or risk overthrow,https://www.foxnews.com/us/trump-tells-nks-kim-to-denuclearize-or-risk-overthrow,MILITARY,Fox News,True,False,Objective,25
96,96,4,but trump warned that failure to make a deal could have grave consequences for kim,4,5/17/2018 0:00,2018,5,17,Associated Press,Trump tells NK's Kim to denuclearize or risk overthrow,https://www.foxnews.com/us/trump-tells-nks-kim-to-denuclearize-or-risk-overthrow,MILITARY,Fox News,True,True,Objective Emotional Appeal,15
97,97,4,mentioning what happened in libya trump said that model would take place if we donapost make a deal,4,5/17/2018 0:00,2018,5,17,Associated Press,Trump tells NK's Kim to denuclearize or risk overthrow,https://www.foxnews.com/us/trump-tells-nks-kim-to-denuclearize-or-risk-overthrow,MILITARY,Fox News,False,False,Unclassifiable,18
98,98,4,the libyan model isnapost the model we have at all,4,5/17/2018 0:00,2018,5,17,Associated Press,Trump tells NK's Kim to denuclearize or risk overthrow,https://www.foxnews.com/us/trump-tells-nks-kim-to-denuclearize-or-risk-overthrow,MILITARY,Fox News,False,False,Unclassifiable,10
99,99,4,in libya we decimated that country,4,5/17/2018 0:00,2018,5,17,Associated Press,Trump tells NK's Kim to denuclearize or risk overthrow,https://www.foxnews.com/us/trump-tells-nks-kim-to-denuclearize-or-risk-overthrow,MILITARY,Fox News,False,True,Subjective Emotional Appeal,6
100,100,4,trump added,4,5/17/2018 0:00,2018,5,17,Associated Press,Trump tells NK's Kim to denuclearize or risk overthrow,https://www.foxnews.com/us/trump-tells-nks-kim-to-denuclearize-or-risk-overthrow,MILITARY,Fox News,False,False,Unclassifiable,2
101,101,4,there was no deal to keep gadhafi,4,5/17/2018 0:00,2018,5,17,Associated Press,Trump tells NK's Kim to denuclearize or risk overthrow,https://www.foxnews.com/us/trump-tells-nks-kim-to-denuclearize-or-risk-overthrow,MILITARY,Fox News,True,False,Objective,7
102,102,4,trump said he is willing to do a lot to provide security guarantees to kim,4,5/17/2018 0:00,2018,5,17,Associated Press,Trump tells NK's Kim to denuclearize or risk overthrow,https://www.foxnews.com/us/trump-tells-nks-kim-to-denuclearize-or-risk-overthrow,MILITARY,Fox News,True,False,Objective,15
103,103,4,the best thing he could do is make a deal,4,5/17/2018 0:00,2018,5,17,Associated Press,Trump tells NK's Kim to denuclearize or risk overthrow,https://www.foxnews.com/us/trump-tells-nks-kim-to-denuclearize-or-risk-overthrow,MILITARY,Fox News,False,False,Subjective,10
104,104,4,trump also suggested china was influencing north koreaaposs thinking regarding the summit pointing to kimaposs visit to china immediately before secretary of state mike pompeo visited pyongyang last week to finalize the summit date and location,4,5/17/2018 0:00,2018,5,17,Associated Press,Trump tells NK's Kim to denuclearize or risk overthrow,https://www.foxnews.com/us/trump-tells-nks-kim-to-denuclearize-or-risk-overthrow,MILITARY,Fox News,True,False,Objective,36
105,105,4,trump said thursday that nothing has changed with respect to north korea after the warning from pyongyang,4,5/17/2018 0:00,2018,5,17,Associated Press,Trump tells NK's Kim to denuclearize or risk overthrow,https://www.foxnews.com/us/trump-tells-nks-kim-to-denuclearize-or-risk-overthrow,MILITARY,Fox News,True,False,Objective,17
106,106,4,he said north korean officials are discussing logistical details about the meeting with the us as if nothing happened,4,5/17/2018 0:00,2018,5,17,Associated Press,Trump tells NK's Kim to denuclearize or risk overthrow,https://www.foxnews.com/us/trump-tells-nks-kim-to-denuclearize-or-risk-overthrow,MILITARY,Fox News,True,False,Objective,19
107,107,4,in addition to threatening to pull out of the meeting with trump the north abruptly canceled a planned meeting with south korean officials over joint ussouth korean military exercises,4,5/17/2018 0:00,2018,5,17,Associated Press,Trump tells NK's Kim to denuclearize or risk overthrow,https://www.foxnews.com/us/trump-tells-nks-kim-to-denuclearize-or-risk-overthrow,MILITARY,Fox News,True,False,Objective,29
108,108,4,pentagon spokeswoman dana white said thursday that the schedule of military exercises hasnapost changed,4,5/17/2018 0:00,2018,5,17,Associated Press,Trump tells NK's Kim to denuclearize or risk overthrow,https://www.foxnews.com/us/trump-tells-nks-kim-to-denuclearize-or-risk-overthrow,MILITARY,Fox News,True,False,Objective,14
109,109,4,she added the annual exercises are longplanned defensive in nature and meant to ensure the readiness of us and south korean forces,4,5/17/2018 0:00,2018,5,17,Associated Press,Trump tells NK's Kim to denuclearize or risk overthrow,https://www.foxnews.com/us/trump-tells-nks-kim-to-denuclearize-or-risk-overthrow,MILITARY,Fox News,True,False,Objective,22
110,110,4,exercise max thunder began monday and concludes may 25,4,5/17/2018 0:00,2018,5,17,Associated Press,Trump tells NK's Kim to denuclearize or risk overthrow,https://www.foxnews.com/us/trump-tells-nks-kim-to-denuclearize-or-risk-overthrow,MILITARY,Fox News,True,False,Objective,9
111,111,4,it includes aircraft from across the us military services,4,5/17/2018 0:00,2018,5,17,Associated Press,Trump tells NK's Kim to denuclearize or risk overthrow,https://www.foxnews.com/us/trump-tells-nks-kim-to-denuclearize-or-risk-overthrow,MILITARY,Fox News,True,False,Objective,9
112,112,4,last yearaposs exercise included roughly 1200 us personnel and about 640 south koreans,4,5/17/2018 0:00,2018,5,17,Associated Press,Trump tells NK's Kim to denuclearize or risk overthrow,https://www.foxnews.com/us/trump-tells-nks-kim-to-denuclearize-or-risk-overthrow,MILITARY,Fox News,True,False,Objective,13
113,113,4,this yearaposs drill is similar,4,5/17/2018 0:00,2018,5,17,Associated Press,Trump tells NK's Kim to denuclearize or risk overthrow,https://www.foxnews.com/us/trump-tells-nks-kim-to-denuclearize-or-risk-overthrow,MILITARY,Fox News,False,False,Unclassifiable,5
114,114,4,speaking at an oval office meeting with nato secretarygeneral jens stoltenberg trump also said he will not discuss us troop levels in south korea during his meeting with kim,4,5/17/2018 0:00,2018,5,17,Associated Press,Trump tells NK's Kim to denuclearize or risk overthrow,https://www.foxnews.com/us/trump-tells-nks-kim-to-denuclearize-or-risk-overthrow,MILITARY,Fox News,True,False,Objective,29
115,115,4,the north has said it wonapost return to talks with seoul due to the exercises,4,5/17/2018 0:00,2018,5,17,Associated Press,Trump tells NK's Kim to denuclearize or risk overthrow,https://www.foxnews.com/us/trump-tells-nks-kim-to-denuclearize-or-risk-overthrow,MILITARY,Fox News,True,False,Objective,15
116,116,4, associated press writer ken thomas contributed to this report,4,5/17/2018 0:00,2018,5,17,Associated Press,Trump tells NK's Kim to denuclearize or risk overthrow,https://www.foxnews.com/us/trump-tells-nks-kim-to-denuclearize-or-risk-overthrow,MILITARY,Fox News,True,False,Objective,10
117,117,5,next image 1 of 2 prev image 2 of 2 jarablus syria  nearly 50 children orphaned by the syrian war escaped the hell that was their hometown of aleppo after they appeared in a distressing video and appealed for their lives as government forces moved in under a hail of fire,5,6/11/2018 0:00,2018,6,11,Associated Press,Syrian orphans who fled Aleppo find new home,https://www.foxnews.com/world/syrian-orphans-who-fled-aleppo-find-new-home,RELIGION,Fox News,False,True,Subjective Emotional Appeal,52
118,118,5,in the year and half since the children and their instructors have been uprooted twice more once to escape similar bombardment in another rebel stronghold and again when they fled a town that has been overwhelmed by people seeking shelter from syriaaposs war,5,6/11/2018 0:00,2018,6,11,Associated Press,Syrian orphans who fled Aleppo find new home,https://www.foxnews.com/world/syrian-orphans-who-fled-aleppo-find-new-home,RELIGION,Fox News,True,True,Objective Emotional Appeal,43
119,119,5,the orphanage first established in rebelheld eastern aleppo known as the center for the exceptional has finally landed in a small house in the sleepy northern town of jarablus which was once a hub for islamic state militants along the border with turkey but has been governed by a turkeybacked administration since 2016,5,6/11/2018 0:00,2018,6,11,Associated Press,Syrian orphans who fled Aleppo find new home,https://www.foxnews.com/world/syrian-orphans-who-fled-aleppo-find-new-home,RELIGION,Fox News,True,False,Objective,53
120,120,5,more than six million people  nearly a quarter of syriaaposs prewar population  have been displaced inside syria because of the war,5,6/11/2018 0:00,2018,6,11,Associated Press,Syrian orphans who fled Aleppo find new home,https://www.foxnews.com/world/syrian-orphans-who-fled-aleppo-find-new-home,RELIGION,Fox News,True,True,Objective Emotional Appeal,23
121,121,5,for aleppoaposs orphans the war trauma and the loss of parents were compounded by the recurrent uprooting from the only familiar place they knew,5,6/11/2018 0:00,2018,6,11,Associated Press,Syrian orphans who fled Aleppo find new home,https://www.foxnews.com/world/syrian-orphans-who-fled-aleppo-find-new-home,RELIGION,Fox News,True,True,Objective Emotional Appeal,24
122,122,5,it was better back home,5,6/11/2018 0:00,2018,6,11,Associated Press,Syrian orphans who fled Aleppo find new home,https://www.foxnews.com/world/syrian-orphans-who-fled-aleppo-find-new-home,RELIGION,Fox News,False,False,Subjective,5
123,123,5,we had our toys and our home,5,6/11/2018 0:00,2018,6,11,Associated Press,Syrian orphans who fled Aleppo find new home,https://www.foxnews.com/world/syrian-orphans-who-fled-aleppo-find-new-home,RELIGION,Fox News,False,False,Subjective,7
124,124,5,we had a court to play in and we had a toys room a looms area and a hall for learning singing said yasmine qamuz an 11yearold orphan whose mother is missing and whose father died of a heart condition in aleppo,5,6/11/2018 0:00,2018,6,11,Associated Press,Syrian orphans who fled Aleppo find new home,https://www.foxnews.com/world/syrian-orphans-who-fled-aleppo-find-new-home,RELIGION,Fox News,True,True,Objective Emotional Appeal,42
125,125,5,qamuz said she left her favorite yellow doll behind in aleppo,5,6/11/2018 0:00,2018,6,11,Associated Press,Syrian orphans who fled Aleppo find new home,https://www.foxnews.com/world/syrian-orphans-who-fled-aleppo-find-new-home,RELIGION,Fox News,True,True,Objective Emotional Appeal,11
126,126,5,the fall of aleppo came after one of the most devastating battles of the civil war now in its eighth year,5,6/11/2018 0:00,2018,6,11,Associated Press,Syrian orphans who fled Aleppo find new home,https://www.foxnews.com/world/syrian-orphans-who-fled-aleppo-find-new-home,RELIGION,Fox News,True,True,Objective Emotional Appeal,21
127,127,5,syriaaposs largest city was for years divided between rebel and governmentcontrolled areas,5,6/11/2018 0:00,2018,6,11,Associated Press,Syrian orphans who fled Aleppo find new home,https://www.foxnews.com/world/syrian-orphans-who-fled-aleppo-find-new-home,RELIGION,Fox News,True,False,Objective,12
128,128,5,after four years of rebel rule the government recaptured eastern aleppo in december 2016 after a monthslong military offensive backed by russia,5,6/11/2018 0:00,2018,6,11,Associated Press,Syrian orphans who fled Aleppo find new home,https://www.foxnews.com/world/syrian-orphans-who-fled-aleppo-find-new-home,RELIGION,Fox News,True,False,Objective,22
129,129,5,the bombardment of eastern aleppo drove residents  including the children  underground,5,6/11/2018 0:00,2018,6,11,Associated Press,Syrian orphans who fled Aleppo find new home,https://www.foxnews.com/world/syrian-orphans-who-fled-aleppo-find-new-home,RELIGION,Fox News,True,True,Objective Emotional Appeal,13
130,130,5,one of the children was wounded by shrapnel when he tried to come up from the basement where they had huddled for weeks,5,6/11/2018 0:00,2018,6,11,Associated Press,Syrian orphans who fled Aleppo find new home,https://www.foxnews.com/world/syrian-orphans-who-fled-aleppo-find-new-home,RELIGION,Fox News,True,True,Objective Emotional Appeal,23
131,131,5,during the siege the orphanage put out an online video in which qamuz the little girl pleaded for an exit route,5,6/11/2018 0:00,2018,6,11,Associated Press,Syrian orphans who fled Aleppo find new home,https://www.foxnews.com/world/syrian-orphans-who-fled-aleppo-find-new-home,RELIGION,Fox News,True,True,Objective Emotional Appeal,21
132,132,5,soon after permission came for their evacuation,5,6/11/2018 0:00,2018,6,11,Associated Press,Syrian orphans who fled Aleppo find new home,https://www.foxnews.com/world/syrian-orphans-who-fled-aleppo-find-new-home,RELIGION,Fox News,True,False,Objective,7
133,133,5,there was a hitch as lastminute negotiations over their destination delayed their departure,5,6/11/2018 0:00,2018,6,11,Associated Press,Syrian orphans who fled Aleppo find new home,https://www.foxnews.com/world/syrian-orphans-who-fled-aleppo-find-new-home,RELIGION,Fox News,True,False,Objective,13
134,134,5,the children were encircled by gunmen for 22 hours in the buses meant to take them out of the crumbling enclave until the deal was finally sealed,5,6/11/2018 0:00,2018,6,11,Associated Press,Syrian orphans who fled Aleppo find new home,https://www.foxnews.com/world/syrian-orphans-who-fled-aleppo-find-new-home,RELIGION,Fox News,True,True,Objective Emotional Appeal,27
135,135,5,first they went to another rebelheld town in the neighboring province of idlib,5,6/11/2018 0:00,2018,6,11,Associated Press,Syrian orphans who fled Aleppo find new home,https://www.foxnews.com/world/syrian-orphans-who-fled-aleppo-find-new-home,RELIGION,Fox News,False,False,Unclassifiable,13
136,136,5,when that came under attack they were moved north to the town of azaz,5,6/11/2018 0:00,2018,6,11,Associated Press,Syrian orphans who fled Aleppo find new home,https://www.foxnews.com/world/syrian-orphans-who-fled-aleppo-find-new-home,RELIGION,Fox News,True,False,Objective,14
137,137,5,but soon that was hit by a huge wave of displaced people so they had to leave again,5,6/11/2018 0:00,2018,6,11,Associated Press,Syrian orphans who fled Aleppo find new home,https://www.foxnews.com/world/syrian-orphans-who-fled-aleppo-find-new-home,RELIGION,Fox News,False,True,Subjective Emotional Appeal,18
138,138,5,jarablus a border town with just over 10000 residents before the war saw its population almost quadruple after the is retreat as newly displaced syrians moved in,5,6/11/2018 0:00,2018,6,11,Associated Press,Syrian orphans who fled Aleppo find new home,https://www.foxnews.com/world/syrian-orphans-who-fled-aleppo-find-new-home,RELIGION,Fox News,True,False,Objective,27
139,139,5,still it remains a small town,5,6/11/2018 0:00,2018,6,11,Associated Press,Syrian orphans who fled Aleppo find new home,https://www.foxnews.com/world/syrian-orphans-who-fled-aleppo-find-new-home,RELIGION,Fox News,False,False,Unclassifiable,6
140,140,5,there are few places for the children to go,5,6/11/2018 0:00,2018,6,11,Associated Press,Syrian orphans who fled Aleppo find new home,https://www.foxnews.com/world/syrian-orphans-who-fled-aleppo-find-new-home,RELIGION,Fox News,False,False,Subjective,9
141,141,5,the only day trip they go on is to the river banks,5,6/11/2018 0:00,2018,6,11,Associated Press,Syrian orphans who fled Aleppo find new home,https://www.foxnews.com/world/syrian-orphans-who-fled-aleppo-find-new-home,RELIGION,Fox News,False,False,Subjective,12
142,142,5,they are city children said hikmat sheihan one of the orphanage administrators,5,6/11/2018 0:00,2018,6,11,Associated Press,Syrian orphans who fled Aleppo find new home,https://www.foxnews.com/world/syrian-orphans-who-fled-aleppo-find-new-home,RELIGION,Fox News,False,False,Unclassifiable,12
143,143,5,in aleppo they had daily visitors or events,5,6/11/2018 0:00,2018,6,11,Associated Press,Syrian orphans who fled Aleppo find new home,https://www.foxnews.com/world/syrian-orphans-who-fled-aleppo-find-new-home,RELIGION,Fox News,True,False,Objective,8
144,144,5,here there are no events and few visitors,5,6/11/2018 0:00,2018,6,11,Associated Press,Syrian orphans who fled Aleppo find new home,https://www.foxnews.com/world/syrian-orphans-who-fled-aleppo-find-new-home,RELIGION,Fox News,True,False,Objective,8
145,145,5,those with them in school are from different environments,5,6/11/2018 0:00,2018,6,11,Associated Press,Syrian orphans who fled Aleppo find new home,https://www.foxnews.com/world/syrian-orphans-who-fled-aleppo-find-new-home,RELIGION,Fox News,True,False,Objective,9
146,146,5,three children who lost their mother  an orphanage worker and their father in the offensive are expected to be reunified with their extended families in aleppo for a short visit,5,6/11/2018 0:00,2018,6,11,Associated Press,Syrian orphans who fled Aleppo find new home,https://www.foxnews.com/world/syrian-orphans-who-fled-aleppo-find-new-home,RELIGION,Fox News,True,True,Objective Emotional Appeal,31
147,147,5,when we left we came here because itaposs a safe area and there is no gunfire or shelling said asmar alhalabi who founded the orphanage in 2015,5,6/11/2018 0:00,2018,6,11,Associated Press,Syrian orphans who fled Aleppo find new home,https://www.foxnews.com/world/syrian-orphans-who-fled-aleppo-find-new-home,RELIGION,Fox News,True,True,Objective Emotional Appeal,27
148,148,5,but with the move private donations also shrank as world attention shifted elsewhere,5,6/11/2018 0:00,2018,6,11,Associated Press,Syrian orphans who fled Aleppo find new home,https://www.foxnews.com/world/syrian-orphans-who-fled-aleppo-find-new-home,RELIGION,Fox News,True,False,Objective,13
149,149,5,on a recent afternoon the children gathered in excitement because of visitors  an associated press team escorted by turkish officials,5,6/11/2018 0:00,2018,6,11,Associated Press,Syrian orphans who fled Aleppo find new home,https://www.foxnews.com/world/syrian-orphans-who-fled-aleppo-find-new-home,RELIGION,Fox News,True,True,Objective Emotional Appeal,21
150,150,5,some of the boys were attending math classes in the basement even though school is on summer recess,5,6/11/2018 0:00,2018,6,11,Associated Press,Syrian orphans who fled Aleppo find new home,https://www.foxnews.com/world/syrian-orphans-who-fled-aleppo-find-new-home,RELIGION,Fox News,True,False,Objective,18
151,151,5,girls sat in a circle and giggled as they said they prefer the summer because it means they donapost have to wake up early,5,6/11/2018 0:00,2018,6,11,Associated Press,Syrian orphans who fled Aleppo find new home,https://www.foxnews.com/world/syrian-orphans-who-fled-aleppo-find-new-home,RELIGION,Fox News,False,False,Subjective,24
152,152,5,in keeping with the schedule of the holy month of ramadan they read the quran during the day and slept early to wake up for the dawn meal,5,6/11/2018 0:00,2018,6,11,Associated Press,Syrian orphans who fled Aleppo find new home,https://www.foxnews.com/world/syrian-orphans-who-fled-aleppo-find-new-home,RELIGION,Fox News,True,False,Objective,28
153,153,5,many said they were fasting,5,6/11/2018 0:00,2018,6,11,Associated Press,Syrian orphans who fled Aleppo find new home,https://www.foxnews.com/world/syrian-orphans-who-fled-aleppo-find-new-home,RELIGION,Fox News,False,False,Unclassifiable,5
154,154,5,alhalabi who the children refer to as baba or dad said the children still reminisce about aleppo,5,6/11/2018 0:00,2018,6,11,Associated Press,Syrian orphans who fled Aleppo find new home,https://www.foxnews.com/world/syrian-orphans-who-fled-aleppo-find-new-home,RELIGION,Fox News,True,False,Objective,17
155,155,5,all the kidsapos memories are of aleppo he said,5,6/11/2018 0:00,2018,6,11,Associated Press,Syrian orphans who fled Aleppo find new home,https://www.foxnews.com/world/syrian-orphans-who-fled-aleppo-find-new-home,RELIGION,Fox News,False,True,Subjective Emotional Appeal,9
156,156,5,we wish we could go back,5,6/11/2018 0:00,2018,6,11,Associated Press,Syrian orphans who fled Aleppo find new home,https://www.foxnews.com/world/syrian-orphans-who-fled-aleppo-find-new-home,RELIGION,Fox News,False,True,Subjective Emotional Appeal,6
157,157,6,paris  the former security aide to president emmanuel macron who triggered an uproar after a video showed him beating a protester acknowledged a huge mistake in attending the demonstration equipped as a police officer but described it as a political error that ended up backfiring against the french leader,6,7/26/2018 0:00,2018,7,26,Associated Press,Aide to France's Macron: Protest beating was 'huge mistake',https://www.foxnews.com/world/aide-to-frances-macron-protest-beating-was-huge-mistake,World,Fox News,True,False,Objective,50
158,158,6,authorities have opened a judicial investigation into alexandre benalla who was fired last week and his office was searched on wednesday,6,7/26/2018 0:00,2018,7,26,Associated Press,Aide to France's Macron: Protest beating was 'huge mistake',https://www.foxnews.com/world/aide-to-frances-macron-protest-beating-was-huge-mistake,World,Fox News,True,False,Objective,21
159,159,6,le monde newspaper published the interview thursday with benalla who had shaved his beard to be less recognizable,6,7/26/2018 0:00,2018,7,26,Associated Press,Aide to France's Macron: Protest beating was 'huge mistake',https://www.foxnews.com/world/aide-to-frances-macron-protest-beating-was-huge-mistake,World,Fox News,True,False,Objective,18
160,160,6,macronaposs office has been criticized for not disclosing the accusations weeks ago and the way it handled them,6,7/26/2018 0:00,2018,7,26,Associated Press,Aide to France's Macron: Protest beating was 'huge mistake',https://www.foxnews.com/world/aide-to-frances-macron-protest-beating-was-huge-mistake,World,Fox News,True,False,Objective,18
161,161,6,the french leader said tuesday at a private gathering of his centrist party that he alone was responsible,6,7/26/2018 0:00,2018,7,26,Associated Press,Aide to France's Macron: Protest beating was 'huge mistake',https://www.foxnews.com/world/aide-to-frances-macron-protest-beating-was-huge-mistake,World,Fox News,True,False,Objective,18
162,162,6,he has not spoken publicly to lawmakers during a week of televised parliamentary sessions but when pressed by journalists on wednesday he downplayed the uproar over benallaaposs actions,6,7/26/2018 0:00,2018,7,26,Associated Press,Aide to France's Macron: Protest beating was 'huge mistake',https://www.foxnews.com/world/aide-to-frances-macron-protest-beating-was-huge-mistake,World,Fox News,True,False,Objective,28
163,163,6,he made a real serious error which i felt was a personal betrayal and told him so,6,7/26/2018 0:00,2018,7,26,Associated Press,Aide to France's Macron: Protest beating was 'huge mistake',https://www.foxnews.com/world/aide-to-frances-macron-protest-beating-was-huge-mistake,World,Fox News,False,True,Subjective Emotional Appeal,17
164,164,6,he was punished for this error and then resumed his work,6,7/26/2018 0:00,2018,7,26,Associated Press,Aide to France's Macron: Protest beating was 'huge mistake',https://www.foxnews.com/world/aide-to-frances-macron-protest-beating-was-huge-mistake,World,Fox News,True,False,Objective,11
165,165,6,when he made a second error he was more severely punished as had been expected macron said,6,7/26/2018 0:00,2018,7,26,Associated Press,Aide to France's Macron: Protest beating was 'huge mistake',https://www.foxnews.com/world/aide-to-frances-macron-protest-beating-was-huge-mistake,World,Fox News,True,False,Objective,17
166,166,6,everyone makes mistakes the response has to be proportional,6,7/26/2018 0:00,2018,7,26,Associated Press,Aide to France's Macron: Protest beating was 'huge mistake',https://www.foxnews.com/world/aide-to-frances-macron-protest-beating-was-huge-mistake,World,Fox News,False,False,Subjective,9
167,167,6,franceaposs parliament has opened up a series of inquiries into benallaaposs role within the macron administration and his request to carry firearms,6,7/26/2018 0:00,2018,7,26,Associated Press,Aide to France's Macron: Protest beating was 'huge mistake',https://www.foxnews.com/world/aide-to-frances-macron-protest-beating-was-huge-mistake,World,Fox News,True,False,Objective,22
168,168,6,the 26yearold claimed credit for choosing the site where macron formally claimed the presidency  the louvre palace  and said his job was to take care of macronaposs private life,6,7/26/2018 0:00,2018,7,26,Associated Press,Aide to France's Macron: Protest beating was 'huge mistake',https://www.foxnews.com/world/aide-to-frances-macron-protest-beating-was-huge-mistake,World,Fox News,True,False,Objective,31
169,169,6,he can be seen in dozens of photos at macronaposs side or just behind him,6,7/26/2018 0:00,2018,7,26,Associated Press,Aide to France's Macron: Protest beating was 'huge mistake',https://www.foxnews.com/world/aide-to-frances-macron-protest-beating-was-huge-mistake,World,Fox News,True,False,Objective,15
170,170,6,i donapost have the sense that i betrayed the president i have the sense that i made a huge mistake to have committed an error benalla said,6,7/26/2018 0:00,2018,7,26,Associated Press,Aide to France's Macron: Protest beating was 'huge mistake',https://www.foxnews.com/world/aide-to-frances-macron-protest-beating-was-huge-mistake,World,Fox News,False,False,Subjective,27
171,171,6,but this error itaposs more from a political point of view i never should have gone to that protest as an observer and then perhaps i should have stayed back,6,7/26/2018 0:00,2018,7,26,Associated Press,Aide to France's Macron: Protest beating was 'huge mistake',https://www.foxnews.com/world/aide-to-frances-macron-protest-beating-was-huge-mistake,World,Fox News,False,False,Subjective,30
172,172,6,benalla said targeting him has been a means to hurt macron,6,7/26/2018 0:00,2018,7,26,Associated Press,Aide to France's Macron: Protest beating was 'huge mistake',https://www.foxnews.com/world/aide-to-frances-macron-protest-beating-was-huge-mistake,World,Fox News,True,False,Objective,11
173,173,6,i am the weak link he said,6,7/26/2018 0:00,2018,7,26,Associated Press,Aide to France's Macron: Protest beating was 'huge mistake',https://www.foxnews.com/world/aide-to-frances-macron-protest-beating-was-huge-mistake,World,Fox News,False,False,Subjective,7
174,174,6,benalla had considered himself a crucial part of macronaposs detail and has criticized his official security the equivalent of the american secret service,6,7/26/2018 0:00,2018,7,26,Associated Press,Aide to France's Macron: Protest beating was 'huge mistake',https://www.foxnews.com/world/aide-to-frances-macron-protest-beating-was-huge-mistake,World,Fox News,False,False,Subjective,23
175,175,6,they arenapost at all involved in organization,6,7/26/2018 0:00,2018,7,26,Associated Press,Aide to France's Macron: Protest beating was 'huge mistake',https://www.foxnews.com/world/aide-to-frances-macron-protest-beating-was-huge-mistake,World,Fox News,False,False,Unclassifiable,7
176,176,6,they only handle security he told le monde,6,7/26/2018 0:00,2018,7,26,Associated Press,Aide to France's Macron: Protest beating was 'huge mistake',https://www.foxnews.com/world/aide-to-frances-macron-protest-beating-was-huge-mistake,World,Fox News,True,False,Objective,8
177,177,6,earlier this week speaking to lawmakers paris police chief michel delpuech denounced what he called unhealthy cronyism to explain benallaaposs apparent sway within franceaposs security apparatus,6,7/26/2018 0:00,2018,7,26,Associated Press,Aide to France's Macron: Protest beating was 'huge mistake',https://www.foxnews.com/world/aide-to-frances-macron-protest-beating-was-huge-mistake,World,Fox News,True,False,Objective,26
178,178,6,however both the interior minister and the police chief said benalla was among some 40 people present in the command room on the night of may 1 watching video screens of the police cleanup operation of the protests,6,7/26/2018 0:00,2018,7,26,Associated Press,Aide to France's Macron: Protest beating was 'huge mistake',https://www.foxnews.com/world/aide-to-frances-macron-protest-beating-was-huge-mistake,World,Fox News,True,False,Objective,38
179,179,7,manila philippines  a philippine communist rebel leader said thursday that the insurgents can no longer hold peace talks with president rodrigo duterteaposs administration and that it is better to help oust him and negotiate with his successor,7,6/28/2018 0:00,2018,6,28,Associated Press,Communist rebels tell Philippine leader: No more talks,https://www.foxnews.com/world/communist-rebels-tell-philippine-leader-no-more-talks,World,Fox News,True,False,Objective,38
180,180,7,jose maria sison said duterte wants the guerrillas to surrender without addressing the social ills that have inflamed one of asiaaposs longest communist rebellions,7,6/28/2018 0:00,2018,6,28,Associated Press,Communist rebels tell Philippine leader: No more talks,https://www.foxnews.com/world/communist-rebels-tell-philippine-leader-no-more-talks,World,Fox News,True,False,Objective,24
181,181,7,he criticized the president for being subservient to us imperialism and blamed him for the traitorous sellout of disputed south china sea territories to china,7,6/28/2018 0:00,2018,6,28,Associated Press,Communist rebels tell Philippine leader: No more talks,https://www.foxnews.com/world/communist-rebels-tell-philippine-leader-no-more-talks,World,Fox News,False,True,Subjective Emotional Appeal,25
182,182,7,after preliminary talks both sides agreed to a new temporary ceasefire on june 21 with peace talks to resume on thursday in norway which has been brokering the decadeslong negotiations,7,6/28/2018 0:00,2018,6,28,Associated Press,Communist rebels tell Philippine leader: No more talks,https://www.foxnews.com/world/communist-rebels-tell-philippine-leader-no-more-talks,World,Fox News,True,False,Objective,30
183,183,7,but duterte delayed the resumption indefinitely antagonizing the guerrillas,7,6/28/2018 0:00,2018,6,28,Associated Press,Communist rebels tell Philippine leader: No more talks,https://www.foxnews.com/world/communist-rebels-tell-philippine-leader-no-more-talks,World,Fox News,True,False,Objective,9
184,184,7,based on the implications drawn from the current impasse the rebel front involved in the talks the national democratic front of the philippines can no longer negotiate with a government of the republic of the philippines that is headed by duterte sison said,7,6/28/2018 0:00,2018,6,28,Associated Press,Communist rebels tell Philippine leader: No more talks,https://www.foxnews.com/world/communist-rebels-tell-philippine-leader-no-more-talks,World,Fox News,True,False,Objective,43
185,185,7,it is relatively easier and more productive for the national democratic front of the philippines to participate in the oustduterte movement and to prepare for peace negotiations with the prospective administration that replaces the duterte regime said sison the founder of the communist party of the philippines who has been in exile in the dutch city of utrecht for more than three decades,7,6/28/2018 0:00,2018,6,28,Associated Press,Communist rebels tell Philippine leader: No more talks,https://www.foxnews.com/world/communist-rebels-tell-philippine-leader-no-more-talks,World,Fox News,False,False,Subjective,63
186,186,7,his comments were posted on the frontaposs website,7,6/28/2018 0:00,2018,6,28,Associated Press,Communist rebels tell Philippine leader: No more talks,https://www.foxnews.com/world/communist-rebels-tell-philippine-leader-no-more-talks,World,Fox News,True,False,Objective,8
187,187,7,duterte shrugged off the threat and said he was ready to continue fighting the insurgents,7,6/28/2018 0:00,2018,6,28,Associated Press,Communist rebels tell Philippine leader: No more talks,https://www.foxnews.com/world/communist-rebels-tell-philippine-leader-no-more-talks,World,Fox News,True,False,Objective,15
188,188,7,the rural rebellion has raged for nearly half a century,7,6/28/2018 0:00,2018,6,28,Associated Press,Communist rebels tell Philippine leader: No more talks,https://www.foxnews.com/world/communist-rebels-tell-philippine-leader-no-more-talks,World,Fox News,True,True,Objective Emotional Appeal,10
189,189,7,if theyaposre not willing to talk to me thataposs fine,7,6/28/2018 0:00,2018,6,28,Associated Press,Communist rebels tell Philippine leader: No more talks,https://www.foxnews.com/world/communist-rebels-tell-philippine-leader-no-more-talks,World,Fox News,False,False,Subjective,10
190,190,7,i have no problem so we continue with the war,7,6/28/2018 0:00,2018,6,28,Associated Press,Communist rebels tell Philippine leader: No more talks,https://www.foxnews.com/world/communist-rebels-tell-philippine-leader-no-more-talks,World,Fox News,False,True,Subjective Emotional Appeal,10
191,191,7,anyway weaposve been there for 50 years what if we add another 30 years,7,6/28/2018 0:00,2018,6,28,Associated Press,Communist rebels tell Philippine leader: No more talks,https://www.foxnews.com/world/communist-rebels-tell-philippine-leader-no-more-talks,World,Fox News,False,False,Subjective,14
192,192,7,duterte told reporters when asked for a reaction,7,6/28/2018 0:00,2018,6,28,Associated Press,Communist rebels tell Philippine leader: No more talks,https://www.foxnews.com/world/communist-rebels-tell-philippine-leader-no-more-talks,World,Fox News,False,False,Unclassifiable,8
193,193,7,the rebellion which has raged since 1969 has left about 40000 combatants and civilians dead and has stunted economic development in the impoverished countryside,7,6/28/2018 0:00,2018,6,28,Associated Press,Communist rebels tell Philippine leader: No more talks,https://www.foxnews.com/world/communist-rebels-tell-philippine-leader-no-more-talks,World,Fox News,True,True,Objective Emotional Appeal,24
194,194,7,the military says a few thousand maoist insurgents are continuing to wage the insurgency,7,6/28/2018 0:00,2018,6,28,Associated Press,Communist rebels tell Philippine leader: No more talks,https://www.foxnews.com/world/communist-rebels-tell-philippine-leader-no-more-talks,World,Fox News,True,False,Objective,14
195,195,7,when he took power in 2016 duterte resumed peace talks with the guerrillas but canceled the negotiations last year to protest continued guerrilla attacks on troops and signed an order declaring the rebel group a terrorist organization,7,6/28/2018 0:00,2018,6,28,Associated Press,Communist rebels tell Philippine leader: No more talks,https://www.foxnews.com/world/communist-rebels-tell-philippine-leader-no-more-talks,World,Fox News,True,False,Objective,37
196,196,7,the rebels suspect duterte delayed the talksapos resumption to allow government forces to proceed with counterinsurgency attacks and to force the rebels to shift the venue of the talks from europe to manila where sison said the guerrillas could be subjected to surveillance and harassment,7,6/28/2018 0:00,2018,6,28,Associated Press,Communist rebels tell Philippine leader: No more talks,https://www.foxnews.com/world/communist-rebels-tell-philippine-leader-no-more-talks,World,Fox News,False,True,Subjective Emotional Appeal,45
197,197,7,the volatile president has invited sison to return home for the talks assuring him of his safety,7,6/28/2018 0:00,2018,6,28,Associated Press,Communist rebels tell Philippine leader: No more talks,https://www.foxnews.com/world/communist-rebels-tell-philippine-leader-no-more-talks,World,Fox News,False,False,Subjective,17
198,198,7,duterte has remained popular despite alarm over his bloody crackdown on illegal drugs and growing condemnation of his often expletiveladen speeches in the largely roman catholic country including one last week in which he called god stupid,7,6/28/2018 0:00,2018,6,28,Associated Press,Communist rebels tell Philippine leader: No more talks,https://www.foxnews.com/world/communist-rebels-tell-philippine-leader-no-more-talks,World,Fox News,True,True,Objective Emotional Appeal,37
199,199,7,the largest protests against duterte have been a fraction of the massive rallies that ousted dictator ferdinand marcos in 1986 and president joseph estrada in 2001,7,6/28/2018 0:00,2018,6,28,Associated Press,Communist rebels tell Philippine leader: No more talks,https://www.foxnews.com/world/communist-rebels-tell-philippine-leader-no-more-talks,World,Fox News,True,False,Objective,26
200,200,7,he stands isolated and ripe for ouster by the broad united front of patriotic and democratic forces sison said but duterte rejected that prospect,7,6/28/2018 0:00,2018,6,28,Associated Press,Communist rebels tell Philippine leader: No more talks,https://www.foxnews.com/world/communist-rebels-tell-philippine-leader-no-more-talks,World,Fox News,False,True,Subjective Emotional Appeal,24
201,201,7,which forces will join him,7,6/28/2018 0:00,2018,6,28,Associated Press,Communist rebels tell Philippine leader: No more talks,https://www.foxnews.com/world/communist-rebels-tell-philippine-leader-no-more-talks,World,Fox News,False,False,Unclassifiable,5
202,202,7,let us see duterte said,7,6/28/2018 0:00,2018,6,28,Associated Press,Communist rebels tell Philippine leader: No more talks,https://www.foxnews.com/world/communist-rebels-tell-philippine-leader-no-more-talks,World,Fox News,False,False,Unclassifiable,5
203,203,8,next image 1 of 2 prev image 2 of 2 singapore  president donald trump cast his tuesday summit with north koreaaposs kim jong un as a onetime shot for the autocratic leader to ditch his nuclear weapons and enter the community of nations saying he would know within moments if kim is serious about the talks,8,6/9/2018 0:00,2018,6,9,Associated Press,Trump casts North Korea summit as 'one-time shot' for Kim,https://www.foxnews.com/world/trump-casts-north-korea-summit-as-one-time-shot-for-kim,World,Fox News,True,False,Objective,57
204,204,8,trump said saturday he was embarking on a mission of peace as he departed the group of seven meeting in canada to fly to the summit site in singapore,8,6/9/2018 0:00,2018,6,9,Associated Press,Trump casts North Korea summit as 'one-time shot' for Kim,https://www.foxnews.com/world/trump-casts-north-korea-summit-as-one-time-shot-for-kim,World,Fox News,True,False,Objective,29
205,205,8,saying he has a clear objective in mind to convince kim to abandon his nuclear program in exchange for unspecified protections from the us trump acknowledged that the direction of the highstakes meeting is unpredictable adding it will always be spur of the moment,8,6/9/2018 0:00,2018,6,9,Associated Press,Trump casts North Korea summit as 'one-time shot' for Kim,https://www.foxnews.com/world/trump-casts-north-korea-summit-as-one-time-shot-for-kim,World,Fox News,True,False,Objective,44
206,206,8,itaposs unknown territory in the truest sense but i really feel confident he told reporters,8,6/9/2018 0:00,2018,6,9,Associated Press,Trump casts North Korea summit as 'one-time shot' for Kim,https://www.foxnews.com/world/trump-casts-north-korea-summit-as-one-time-shot-for-kim,World,Fox News,False,False,Subjective,15
207,207,8,i feel that kim jong un wants to do something great for his people and he has that opportunity and he wonapost have that opportunity again,8,6/9/2018 0:00,2018,6,9,Associated Press,Trump casts North Korea summit as 'one-time shot' for Kim,https://www.foxnews.com/world/trump-casts-north-korea-summit-as-one-time-shot-for-kim,World,Fox News,False,False,Subjective,26
208,208,8,itaposs a onetime shot and i think itaposs going to work out very well he said,8,6/9/2018 0:00,2018,6,9,Associated Press,Trump casts North Korea summit as 'one-time shot' for Kim,https://www.foxnews.com/world/trump-casts-north-korea-summit-as-one-time-shot-for-kim,World,Fox News,False,False,Subjective,16
209,209,8,the meeting will be the first between a sitting us president and a north korean leader,8,6/9/2018 0:00,2018,6,9,Associated Press,Trump casts North Korea summit as 'one-time shot' for Kim,https://www.foxnews.com/world/trump-casts-north-korea-summit-as-one-time-shot-for-kim,World,Fox News,True,False,Objective,16
210,210,8,unlike traditional summits between heads of state where most of the work is completed in advance of a photoop us officials say the only thing certain ahead of these talks will be their unpredictability,8,6/9/2018 0:00,2018,6,9,Associated Press,Trump casts North Korea summit as 'one-time shot' for Kim,https://www.foxnews.com/world/trump-casts-north-korea-summit-as-one-time-shot-for-kim,World,Fox News,True,False,Objective,34
211,211,8,raising expectations in advance of the meeting trump said the outcome will rely heavily on his own instincts,8,6/9/2018 0:00,2018,6,9,Associated Press,Trump casts North Korea summit as 'one-time shot' for Kim,https://www.foxnews.com/world/trump-casts-north-korea-summit-as-one-time-shot-for-kim,World,Fox News,False,False,Subjective,18
212,212,8,the us president who prides himself on his dealmaking prowess said he will know within the first minute of meeting kim whether the north korean leader is serious about the nuclear negotiations,8,6/9/2018 0:00,2018,6,9,Associated Press,Trump casts North Korea summit as 'one-time shot' for Kim,https://www.foxnews.com/world/trump-casts-north-korea-summit-as-one-time-shot-for-kim,World,Fox News,False,False,Subjective,32
213,213,8,i think iaposll know pretty quickly whether or not in my opinion something positive will happen,8,6/9/2018 0:00,2018,6,9,Associated Press,Trump casts North Korea summit as 'one-time shot' for Kim,https://www.foxnews.com/world/trump-casts-north-korea-summit-as-one-time-shot-for-kim,World,Fox News,False,False,Subjective,16
214,214,8,and if i think it wonapost happen iaposm not going to waste my time,8,6/9/2018 0:00,2018,6,9,Associated Press,Trump casts North Korea summit as 'one-time shot' for Kim,https://www.foxnews.com/world/trump-casts-north-korea-summit-as-one-time-shot-for-kim,World,Fox News,False,False,Subjective,14
215,215,8,i donapost want to waste his time trump said,8,6/9/2018 0:00,2018,6,9,Associated Press,Trump casts North Korea summit as 'one-time shot' for Kim,https://www.foxnews.com/world/trump-casts-north-korea-summit-as-one-time-shot-for-kim,World,Fox News,False,False,Subjective,9
216,216,8,this is a leader who really is an unknown personality trump added of kim,8,6/9/2018 0:00,2018,6,9,Associated Press,Trump casts North Korea summit as 'one-time shot' for Kim,https://www.foxnews.com/world/trump-casts-north-korea-summit-as-one-time-shot-for-kim,World,Fox News,False,True,Subjective Emotional Appeal,14
217,217,8,people donapost know much about him,8,6/9/2018 0:00,2018,6,9,Associated Press,Trump casts North Korea summit as 'one-time shot' for Kim,https://www.foxnews.com/world/trump-casts-north-korea-summit-as-one-time-shot-for-kim,World,Fox News,False,False,Subjective,6
218,218,8,i think that heaposs going to surprise on the upside very much on the upside,8,6/9/2018 0:00,2018,6,9,Associated Press,Trump casts North Korea summit as 'one-time shot' for Kim,https://www.foxnews.com/world/trump-casts-north-korea-summit-as-one-time-shot-for-kim,World,Fox News,False,False,Subjective,15
219,219,8,the kim sitdown comes as trumpaposs international negotiating skills have faced their toughest tests to date with mixed results,8,6/9/2018 0:00,2018,6,9,Associated Press,Trump casts North Korea summit as 'one-time shot' for Kim,https://www.foxnews.com/world/trump-casts-north-korea-summit-as-one-time-shot-for-kim,World,Fox News,True,False,Objective,19
220,220,8,tensions flared at the g7 summit between trump and us allies over his protectionist economic policies and decisions to exit the iran nuclear deal and paris climate accord,8,6/9/2018 0:00,2018,6,9,Associated Press,Trump casts North Korea summit as 'one-time shot' for Kim,https://www.foxnews.com/world/trump-casts-north-korea-summit-as-one-time-shot-for-kim,World,Fox News,True,True,Objective Emotional Appeal,28
221,221,8,trump rated his relationships with us partners as a 10 though erstwhile allies spent much of the weekend directly challenging trumpaposs policy positions,8,6/9/2018 0:00,2018,6,9,Associated Press,Trump casts North Korea summit as 'one-time shot' for Kim,https://www.foxnews.com/world/trump-casts-north-korea-summit-as-one-time-shot-for-kim,World,Fox News,True,False,Objective,23
222,222,8,as he looks to the kim meeting trump is taking a highstakes risk in hopes of containing the increasingly challenging national security threats from north koreaaposs advanced nuclear and ballistic missile programs,8,6/9/2018 0:00,2018,6,9,Associated Press,Trump casts North Korea summit as 'one-time shot' for Kim,https://www.foxnews.com/world/trump-casts-north-korea-summit-as-one-time-shot-for-kim,World,Fox News,True,False,Objective,32
223,223,8,seeing nobel peace prize laurels and eyeing potential to show up his critics at home and abroad trump is granting kim the international legitimacy heaposs long sought in hopes of securing a legacydefining accord,8,6/9/2018 0:00,2018,6,9,Associated Press,Trump casts North Korea summit as 'one-time shot' for Kim,https://www.foxnews.com/world/trump-casts-north-korea-summit-as-one-time-shot-for-kim,World,Fox News,False,True,Subjective Emotional Appeal,34
224,224,8,he could take that nation with those great people and truly make it great trump said,8,6/9/2018 0:00,2018,6,9,Associated Press,Trump casts North Korea summit as 'one-time shot' for Kim,https://www.foxnews.com/world/trump-casts-north-korea-summit-as-one-time-shot-for-kim,World,Fox News,False,False,Subjective,16
225,225,8,thataposs why i feel positive because it makes so much sense,8,6/9/2018 0:00,2018,6,9,Associated Press,Trump casts North Korea summit as 'one-time shot' for Kim,https://www.foxnews.com/world/trump-casts-north-korea-summit-as-one-time-shot-for-kim,World,Fox News,False,False,Subjective,11
226,226,8,trump also praised the north koreans saying they have been really working very well with us during preparations for the summit even though trump had canceled the summit last month following a recent period of what he called tremendous anger and open hostility from the north korean government,8,6/9/2018 0:00,2018,6,9,Associated Press,Trump casts North Korea summit as 'one-time shot' for Kim,https://www.foxnews.com/world/trump-casts-north-korea-summit-as-one-time-shot-for-kim,World,Fox News,True,False,Objective,48
227,227,8,but then trump did a quick pivot signaling almost immediately after scrapping the meeting that he was open to going ahead with it after all,8,6/9/2018 0:00,2018,6,9,Associated Press,Trump casts North Korea summit as 'one-time shot' for Kim,https://www.foxnews.com/world/trump-casts-north-korea-summit-as-one-time-shot-for-kim,World,Fox News,True,False,Objective,25
228,228,8,delegations from both countries then launched into a frenetic period of negotiations that are expected to culminate with tuesdayaposs meeting,8,6/9/2018 0:00,2018,6,9,Associated Press,Trump casts North Korea summit as 'one-time shot' for Kim,https://www.foxnews.com/world/trump-casts-north-korea-summit-as-one-time-shot-for-kim,World,Fox News,False,False,Unclassifiable,20
229,229,8,so far so good,8,6/9/2018 0:00,2018,6,9,Associated Press,Trump casts North Korea summit as 'one-time shot' for Kim,https://www.foxnews.com/world/trump-casts-north-korea-summit-as-one-time-shot-for-kim,World,Fox News,False,False,Unclassifiable,4
230,230,8,weaposre going to have to see what happens,8,6/9/2018 0:00,2018,6,9,Associated Press,Trump casts North Korea summit as 'one-time shot' for Kim,https://www.foxnews.com/world/trump-casts-north-korea-summit-as-one-time-shot-for-kim,World,Fox News,False,False,Subjective,8
231,231,8,i very much look forward to it trump said,8,6/9/2018 0:00,2018,6,9,Associated Press,Trump casts North Korea summit as 'one-time shot' for Kim,https://www.foxnews.com/world/trump-casts-north-korea-summit-as-one-time-shot-for-kim,World,Fox News,False,False,Subjective,9
232,232,8,still questions remain about what a deal on the northaposs nuclear weapons could look like,8,6/9/2018 0:00,2018,6,9,Associated Press,Trump casts North Korea summit as 'one-time shot' for Kim,https://www.foxnews.com/world/trump-casts-north-korea-summit-as-one-time-shot-for-kim,World,Fox News,False,False,Unclassifiable,15
233,233,8,trump has said he believes kim would agree to denuclearization  and secretary of state mike pompeo said thursday he had received kimaposs personal assurances to that effect  but the two countries have offered differing visions of what that would entail,8,6/9/2018 0:00,2018,6,9,Associated Press,Trump casts North Korea summit as 'one-time shot' for Kim,https://www.foxnews.com/world/trump-casts-north-korea-summit-as-one-time-shot-for-kim,World,Fox News,True,False,Objective,42
234,234,8,despite kimaposs apparent eagerness for a summit with trump there are doubts that he would fully relinquish his nuclear arsenal which he may see as his guarantee of survival,8,6/9/2018 0:00,2018,6,9,Associated Press,Trump casts North Korea summit as 'one-time shot' for Kim,https://www.foxnews.com/world/trump-casts-north-korea-summit-as-one-time-shot-for-kim,World,Fox News,True,False,Objective,29
235,235,8,us defense and intelligence officials have assessed the north to be on the threshold of having the capability to strike anywhere in the continental us with a nucleartipped missile  a capacity that trump and other us officials have said they would not tolerate,8,6/9/2018 0:00,2018,6,9,Associated Press,Trump casts North Korea summit as 'one-time shot' for Kim,https://www.foxnews.com/world/trump-casts-north-korea-summit-as-one-time-shot-for-kim,World,Fox News,True,False,Objective,44
236,236,8,trump reiterated his promise saturday that the us will watch over and weaposll protect kim and his government in return for him giving up the nuclear program,8,6/9/2018 0:00,2018,6,9,Associated Press,Trump casts North Korea summit as 'one-time shot' for Kim,https://www.foxnews.com/world/trump-casts-north-korea-summit-as-one-time-shot-for-kim,World,Fox News,True,False,Objective,27
237,237,8,he also indicated that south korea china and japan would be prepared to invest in the north to boost its besieged economy,8,6/9/2018 0:00,2018,6,9,Associated Press,Trump casts North Korea summit as 'one-time shot' for Kim,https://www.foxnews.com/world/trump-casts-north-korea-summit-as-one-time-shot-for-kim,World,Fox News,True,False,Objective,22
238,238,8, lucey reported from la malbaie quebec,8,6/9/2018 0:00,2018,6,9,Associated Press,Trump casts North Korea summit as 'one-time shot' for Kim,https://www.foxnews.com/world/trump-casts-north-korea-summit-as-one-time-shot-for-kim,World,Fox News,True,False,Objective,7
239,239,8,associated press writer darlene superville in washington contributed to this report,8,6/9/2018 0:00,2018,6,9,Associated Press,Trump casts North Korea summit as 'one-time shot' for Kim,https://www.foxnews.com/world/trump-casts-north-korea-summit-as-one-time-shot-for-kim,World,Fox News,True,False,Objective,11
240,240,9,close video browder appalled by white house reaction to putin request white house says there was a conversation about allowing russian investigators to question bill browder browder reacts on the story with martha maccallum,9,7/18/2018 0:00,2018,7,18,Fox News,Browder 'appalled' by White House reaction to Putin request,https://www.foxnews.com/transcript/browder-appalled-by-white-house-reaction-to-putin-request,Transcript,Fox News,False,False,Unclassifiable,34
241,241,9,this is a rush transcript from the story july 18 2018,9,7/18/2018 0:00,2018,7,18,Fox News,Browder 'appalled' by White House reaction to Putin request,https://www.foxnews.com/transcript/browder-appalled-by-white-house-reaction-to-putin-request,Transcript,Fox News,False,False,Unclassifiable,11
242,242,9,this copy may not be in its final form and may be updated,9,7/18/2018 0:00,2018,7,18,Fox News,Browder 'appalled' by White House reaction to Putin request,https://www.foxnews.com/transcript/browder-appalled-by-white-house-reaction-to-putin-request,Transcript,Fox News,False,False,Unclassifiable,13
243,243,9,martha maccallum host all right breaking this evening bill browder who was once the westaposs biggest investor in russia now after fighting to escape the clutches of vladimir putin fears that he may become part of some kind of exchange underway for 12 russian intel agents after he heard this,9,7/18/2018 0:00,2018,7,18,Fox News,Browder 'appalled' by White House reaction to Putin request,https://www.foxnews.com/transcript/browder-appalled-by-white-house-reaction-to-putin-request,Transcript,Fox News,False,False,Unclassifiable,50
244,244,9,begin video clip vladimir putin president of russia through translator we can actually permit official representatives of the united states including the members of this very commission headed by mr mueller,9,7/18/2018 0:00,2018,7,18,Fox News,Browder 'appalled' by White House reaction to Putin request,https://www.foxnews.com/transcript/browder-appalled-by-white-house-reaction-to-putin-request,Transcript,Fox News,True,False,Objective,31
245,245,9,we can let them into the country and they will be present to this questioning,9,7/18/2018 0:00,2018,7,18,Fox News,Browder 'appalled' by White House reaction to Putin request,https://www.foxnews.com/transcript/browder-appalled-by-white-house-reaction-to-putin-request,Transcript,Fox News,False,False,Unclassifiable,15
246,246,9,and then we would expect that the americans would reciprocate and so we can bring up the mr browder in this particular case,9,7/18/2018 0:00,2018,7,18,Fox News,Browder 'appalled' by White House reaction to Putin request,https://www.foxnews.com/transcript/browder-appalled-by-white-house-reaction-to-putin-request,Transcript,Fox News,False,False,Subjective,23
247,247,9,end video clip maccallum and then today this,9,7/18/2018 0:00,2018,7,18,Fox News,Browder 'appalled' by White House reaction to Putin request,https://www.foxnews.com/transcript/browder-appalled-by-white-house-reaction-to-putin-request,Transcript,Fox News,False,False,Unclassifiable,8
248,248,9,begin video clip maggie haberman cnn political analyst russian authorities yesterday named several americans who they want to question who they claim were involved in bill browderaposs crimes in their terms,9,7/18/2018 0:00,2018,7,18,Fox News,Browder 'appalled' by White House reaction to Putin request,https://www.foxnews.com/transcript/browder-appalled-by-white-house-reaction-to-putin-request,Transcript,Fox News,True,False,Objective,31
249,249,9,does president trumpaposs support that idea is he open to having us officials questioned by russia,9,7/18/2018 0:00,2018,7,18,Fox News,Browder 'appalled' by White House reaction to Putin request,https://www.foxnews.com/transcript/browder-appalled-by-white-house-reaction-to-putin-request,Transcript,Fox News,False,False,Unclassifiable,16
250,250,9,sarah sanders white house press secretary there was some conversation about it but there wasnapost a commitment made on behalf of the united states and the president will work with his team and weaposll let you know if thereaposs an announcement on that front,9,7/18/2018 0:00,2018,7,18,Fox News,Browder 'appalled' by White House reaction to Putin request,https://www.foxnews.com/transcript/browder-appalled-by-white-house-reaction-to-putin-request,Transcript,Fox News,False,False,Unclassifiable,44
251,251,9,end video clip maccallum good evening everybody,9,7/18/2018 0:00,2018,7,18,Fox News,Browder 'appalled' by White House reaction to Putin request,https://www.foxnews.com/transcript/browder-appalled-by-white-house-reaction-to-putin-request,Transcript,Fox News,False,False,Unclassifiable,7
252,252,9,iaposm martha maccallum and this is the story,9,7/18/2018 0:00,2018,7,18,Fox News,Browder 'appalled' by White House reaction to Putin request,https://www.foxnews.com/transcript/browder-appalled-by-white-house-reaction-to-putin-request,Transcript,Fox News,False,False,Unclassifiable,8
253,253,9,bill browder was once a successful american businessman working in russia until 2005 when he was suddenly expelled from the country,9,7/18/2018 0:00,2018,7,18,Fox News,Browder 'appalled' by White House reaction to Putin request,https://www.foxnews.com/transcript/browder-appalled-by-white-house-reaction-to-putin-request,Transcript,Fox News,True,False,Objective,21
254,254,9,his company was seized by russian authorities and used then in a massive tax fraud scheme,9,7/18/2018 0:00,2018,7,18,Fox News,Browder 'appalled' by White House reaction to Putin request,https://www.foxnews.com/transcript/browder-appalled-by-white-house-reaction-to-putin-request,Transcript,Fox News,True,True,Objective Emotional Appeal,16
255,255,9,he then hired russian lawyer sergei magnitsky a name that you have heard a lot of lately to investigate what was going on,9,7/18/2018 0:00,2018,7,18,Fox News,Browder 'appalled' by White House reaction to Putin request,https://www.foxnews.com/transcript/browder-appalled-by-white-house-reaction-to-putin-request,Transcript,Fox News,True,False,Objective,23
256,256,9,magnitsky was then thrown into a russian prison,9,7/18/2018 0:00,2018,7,18,Fox News,Browder 'appalled' by White House reaction to Putin request,https://www.foxnews.com/transcript/browder-appalled-by-white-house-reaction-to-putin-request,Transcript,Fox News,True,True,Objective Emotional Appeal,8
257,257,9,he died there after being beaten and denied medical care,9,7/18/2018 0:00,2018,7,18,Fox News,Browder 'appalled' by White House reaction to Putin request,https://www.foxnews.com/transcript/browder-appalled-by-white-house-reaction-to-putin-request,Transcript,Fox News,True,True,Objective Emotional Appeal,10
258,258,9,ever since then bill browder has campaigned to punish russia,9,7/18/2018 0:00,2018,7,18,Fox News,Browder 'appalled' by White House reaction to Putin request,https://www.foxnews.com/transcript/browder-appalled-by-white-house-reaction-to-putin-request,Transcript,Fox News,True,False,Objective,10
259,259,9,and he says his efforts have made him vladimir putinaposs numberone foreign enemy,9,7/18/2018 0:00,2018,7,18,Fox News,Browder 'appalled' by White House reaction to Putin request,https://www.foxnews.com/transcript/browder-appalled-by-white-house-reaction-to-putin-request,Transcript,Fox News,False,True,Subjective Emotional Appeal,13
260,260,9,bill browder joins us now from an undisclosed location this evening,9,7/18/2018 0:00,2018,7,18,Fox News,Browder 'appalled' by White House reaction to Putin request,https://www.foxnews.com/transcript/browder-appalled-by-white-house-reaction-to-putin-request,Transcript,Fox News,True,False,Objective,11
261,261,9,bill good evening once again to you,9,7/18/2018 0:00,2018,7,18,Fox News,Browder 'appalled' by White House reaction to Putin request,https://www.foxnews.com/transcript/browder-appalled-by-white-house-reaction-to-putin-request,Transcript,Fox News,False,False,Unclassifiable,7
262,262,9,what was your reaction when you heard vladimir putin mention your name,9,7/18/2018 0:00,2018,7,18,Fox News,Browder 'appalled' by White House reaction to Putin request,https://www.foxnews.com/transcript/browder-appalled-by-white-house-reaction-to-putin-request,Transcript,Fox News,False,False,Subjective,12
263,263,9,i know you spoke about that here the other night,9,7/18/2018 0:00,2018,7,18,Fox News,Browder 'appalled' by White House reaction to Putin request,https://www.foxnews.com/transcript/browder-appalled-by-white-house-reaction-to-putin-request,Transcript,Fox News,False,False,Subjective,10
264,264,9,but then how about what you heard at the white house today,9,7/18/2018 0:00,2018,7,18,Fox News,Browder 'appalled' by White House reaction to Putin request,https://www.foxnews.com/transcript/browder-appalled-by-white-house-reaction-to-putin-request,Transcript,Fox News,False,False,Unclassifiable,12
265,265,9,bill browder cofounder hermitage capital management i was absolutely appalled by what i heard at the white house today,9,7/18/2018 0:00,2018,7,18,Fox News,Browder 'appalled' by White House reaction to Putin request,https://www.foxnews.com/transcript/browder-appalled-by-white-house-reaction-to-putin-request,Transcript,Fox News,False,True,Subjective Emotional Appeal,19
266,266,9,you know what vladimir putin wants we know heaposs a bad guy,9,7/18/2018 0:00,2018,7,18,Fox News,Browder 'appalled' by White House reaction to Putin request,https://www.foxnews.com/transcript/browder-appalled-by-white-house-reaction-to-putin-request,Transcript,Fox News,False,True,Subjective Emotional Appeal,12
267,267,9,we know heaposs coming after me because  yes weaposre  because of the magnitsky act,9,7/18/2018 0:00,2018,7,18,Fox News,Browder 'appalled' by White House reaction to Putin request,https://www.foxnews.com/transcript/browder-appalled-by-white-house-reaction-to-putin-request,Transcript,Fox News,False,False,Unclassifiable,16
268,268,9,but to have  to have the white house press secretary saying that they havenapost decisively ruled it out right off the bat and theyaposre considering this unseemly trade of me and a bunch of good american people for these russian spies is absolutely appalling and ridiculous,9,7/18/2018 0:00,2018,7,18,Fox News,Browder 'appalled' by White House reaction to Putin request,https://www.foxnews.com/transcript/browder-appalled-by-white-house-reaction-to-putin-request,Transcript,Fox News,False,True,Subjective Emotional Appeal,47
269,269,9,maccallum the magnitsky act was passed by congress and it put sanctions on vladimir putin on many  on many of his wealthiest friends in terms of what travel they could have,9,7/18/2018 0:00,2018,7,18,Fox News,Browder 'appalled' by White House reaction to Putin request,https://www.foxnews.com/transcript/browder-appalled-by-white-house-reaction-to-putin-request,Transcript,Fox News,True,False,Objective,32
270,270,9,this has irritated him to no end and he wants it lifted,9,7/18/2018 0:00,2018,7,18,Fox News,Browder 'appalled' by White House reaction to Putin request,https://www.foxnews.com/transcript/browder-appalled-by-white-house-reaction-to-putin-request,Transcript,Fox News,False,True,Subjective Emotional Appeal,12
